Date,news,output
01-03-2022,NCLAT remands back BMW-Parsoli Motors dispute,1
01-03-2022,Snowstorm on border after storm of war,1
02-03-2022,BIS raids induction motors unit,1
02-03-2022,Putin goes to war and Goa feels the pinch as tourists stay away,0
02-03-2022,"Power secy blames ‘procedural delay’, Tata Power refutes",1
02-03-2022,Ukraine crisis: India seeks safe passage as student dies; 4000 still in war zone,0
03-03-2022,"Sebi didn’t dilute NSE orders, acted within remit, says Tyagi",1
03-03-2022,Ukraine crisis: International Criminal Court prosecutor to investigate potential war crimes,1
03-03-2022,MP exporters hit by war in Ukraine,1
03-03-2022,"Sensex dives 778 pts as crude surges, FPIs sell",0
04-03-2022,"Sensex loses initial gains, closes 366 points in red",0
05-03-2022,Vayu Shakti drill cancelled due to Russia-Ukraine war,1
05-03-2022,Sensex dives 769 points to 8-month low,0
05-03-2022,"T, NSE ink MoU to help MSMEs raise funds on Emerge exchange",1
05-03-2022,Sensex dives 769 points to 8-month low,0
06-03-2022,Webinar held on Ukraine war,1
06-03-2022,"Putin’s war pushes up wheat price, may benefit Indian farmers",0
06-03-2022,Putin likens Western sanctions to war as Russian assault traps Ukrainian civilians,0
06-03-2022,"NSE ex-CEO Chitra Ramkrishna may have cooked up ‘yogi’ story, says court, denies bail",1
07-03-2022,Some shareholders back NSE team as co invites applications for CEO,1
08-03-2022,"Oil at nearly 14-year high, sensex sheds 1,500 points, rupee breaches 77/$",0
08-03-2022,"Oil at nearly 14-year high, sensex sheds 1,500 points, rupee breaches 77/$",0
08-03-2022,7 days CBI custody for NSE ex-CEO,0
08-03-2022,"7 days in a metro station as Kharkiv was bombed, war finally behind him",1
08-03-2022,"At PGI, war veteran motivates young doctors",1
08-03-2022,"Sensex dives 1,500 points to 7-month low",0
08-03-2022,Sensex dives 1.5k pts to 7-mth low,0
08-03-2022,Sensex dives 1.5k pts to 7-mth low,0
09-03-2022,"Sensex up 581 pts as IT, pharma rally on weak ₹",2
09-03-2022,Mumbai: Notice to Tata for its actions on outage day,0
09-03-2022,"Maharashtra: Men’s death rate higher, more died than women in all three waves of Covid pandemic",1
09-03-2022,"Sensex up 581 pts as IT, pharma rally on weak rupee",2
09-03-2022,NSE MD Limaye not to seek another term,0
10-03-2022,Sensex rebounds 1.2k points to 54.6k on positive global cues,2
10-03-2022,Co backed by Tata Power acquires UP energy firm,2
10-03-2022,Court slams CBI for tardy progress in NSE probe,1
10-03-2022,Company backed by Tata Power acquires UP energy firm,2
10-03-2022,FGPDA: Fuel shortage in S’rashtra due to Ukraine war,1
11-03-2022,Sensex scores biggest gain post-state results,2
11-03-2022,Meet the 24-year-old Kolkata pilot who flew out 800 students from Ukraine war zone,1
11-03-2022,Crisil retains growth forecast for FY23 at 7.8% despite war,2
11-03-2022,Sensex scores biggest gain post-state results,2
12-03-2022,Sensex gains for 4th day but ends flat,2
14-03-2022,"Log in for classes, Ukraine universities ask Indian medical students ‘locked out’ by war",1
15-03-2022,"Mayor Vitali Klitschko, who helped ‘RRR’ shoot in Kyiv, is leading Ukraine's resistance in the war against Russia, says line producer of the film",1
15-03-2022,Mumbai: Tata Power’s distribution loss ‘lowest’,2
15-03-2022,"Sensex rises for 5th day, up 3.6k pts from March 7 low",2
16-03-2022,Mercedes to continue EV investments despite Ukraine war disruptions,1
17-03-2022,Ahmedabad: Tata Motors set to take over Ford’s Sanand plant,2
17-03-2022,"1971 war veteran, wheelchair sporting legend passes away",1
17-03-2022,Ukraine war film is a missed opportunity for organisers,1
17-03-2022,Sensex soars over 1k pts as crude oil prices slide,2
17-03-2022,"Sensex soars over 1,000 points as crude oil prices slide",2
18-03-2022,"Russia-Ukraine war may take toll on festive, wedding budgets",1
18-03-2022,Tata Group focused on building biz for future: Chairman,2
18-03-2022,Pandemic after-effect: Covid cases on wane but sleep cycle yet to return to old normal,1
18-03-2022,Tata Grp focused on building biz for the future: Chairman,2
19-03-2022,Ukraine's cultural capital no longer distant from the war,1
19-03-2022,"Inflation set to go up, govt must act to protect people: Rahul Gandhi",1
19-03-2022,War pushes up sunflower oil prices to Rs 190 per litre,0
20-03-2022,Hotel management interns keep away from European stints amid Ukraine war,1
20-03-2022,"After pandemic hiatus, NH7 Weekender back in city",1
20-03-2022,Edible oil prices on the boil post Ukraine war,0
21-03-2022,SNK league: India Motors XI to clash with National Cricket Club in finals,1
21-03-2022,Rahaads reopen for Rangpanchami after 2 years of pandemic,1
21-03-2022,"Pandemic aggravates dropout rate in 2020-21, reveals report",1
23-03-2022,"TRS takes paddy war to Delhi, mins to meet Goyal",1
23-03-2022,Sensex rebounds 1% on global rally,2
24-03-2022,Haryana: Two-day field survey to assess learning gap due to Covid pandemic,1
24-03-2022,Russian IT professionals leave country amid war,1
24-03-2022,Tata gifts Sabal to PwDs in Steel City,2
24-03-2022,"Active Covid cases drop to 50, lowest since pandemic began",1
24-03-2022,Covid pandemic sweetens the pill for non-pharmaceutical players in Gujarat,1
26-03-2022,RBI board assesses hit to eco from Ukraine war,1
26-03-2022,"ID adds muscle over 2 pandemic years, gets 300 Covid beds, 15 BiPAP machines",1
26-03-2022,RBI board assesses hit to eco from Ukraine war,1
26-03-2022,MSEDCL & Tata Power tariffs to go down 2-4% in Mumbai from April 1,2
26-03-2022,War has forced fuel price hikes: Nirmala Sitharaman,0
26-03-2022,Russia signals narrowing war aims on 'liberating' Donbass,1
27-03-2022,"Stuck in war zone, Uttar Pradesh businessman helps Ukraine fight with medicines",1
27-03-2022,Long power cuts outside Tata Steel areas add to summer woes,2
27-03-2022,"66 airlines, 40+ nations and 3,249 weekly flights: Skies reopen after 2-year pandemic break",2
28-03-2022,Congress strengthens social media war room,1
28-03-2022,Tata workers sit on dharna for pay hike,0
28-03-2022,KV Dham revives temple’s incomeafter severe dip during pandemic,1
28-03-2022,Travel bug bites after 2 years of pandemic lull,1
29-03-2022,"Sensex swings 700 pts, gains on global cues",2
29-03-2022,Kolkata athletes fight pandemic blues to train for mega triathlon,1
31-03-2022,Russia-Ukraine war fails to sour Nashik grape exports,0
31-03-2022,Students happy but yet to get over pandemic ‘blues’,1
01-04-2022,"Sensex jumps 17% in FY22, among best shows globally",2
02-04-2022,Gold demand nosedives amidst Russia-Ukraine war,1
04-04-2022,Cong netas protest against inflation,1
04-04-2022,RBI likely to hold rates as war clouds growth outlook,1
04-04-2022,RBI likely to hold rates as war clouds growth outlook,1
05-04-2022,Fests return to college and university campuses after 2-year pandemic break,1
05-04-2022,Putin's war set to put extra burden of ₹1 lakh cr on fertiliser subsidy bill,1
05-04-2022,"Sensex rallies over 1,300 pts on back of HDFC twins",2
05-04-2022,Tata Power arm commissions 300MW solar plant in Dholera,1
05-04-2022,"Sensex rallies over 1,300 points on back of HDFC twins",2
05-04-2022,Rotary holds 1st meet after pandemic,1
06-04-2022,"As pandemic ebbs, healthcare staff have a new challenge — finding jobs",1
07-04-2022,Tata Motors to put ₹24k cr in passenger biz,2
08-04-2022,Tata Steel to set up third ITI,1
08-04-2022,Tata arm’s resolution plan gets NCLT nod,1
08-04-2022,Russia-Ukraine war opens gates for export of more Indian products: CAIT,2
09-04-2022,"Sensex rallies on status quo, bond yield hits 3-yr high",2
09-04-2022,"Sensex rallies on status quo, bond yield hits 3-yr high",2
09-04-2022,RBI raises inflation projection to 5.7%,0
12-04-2022,Veranda Learning opens at 14% premium on BSE,1
12-04-2022,Tata Steel puts Rs 625crore in arm to buy Rohit Ferro,1
12-04-2022,Tech helped judiciary tackle pandemic challenges: Union min,1
14-04-2022,Inflation bites: Fast food prices up 5-10%,0
14-04-2022,Gujarat: Tata Motors to produce 2 lakh electric vehicles at Ford plant,2
15-04-2022,"US banks build reserves on inflation risk, Russia; trading a bright spot",1
15-04-2022,Tata Neu appto host otherbrands too,1
15-04-2022,Communities put pandemic behind them to celebrate a new start with friends & family,1
15-04-2022,Gujarat cos outperform Nifty from March low,0
16-04-2022,"Putin’s war opens a window, India to export wheat to Egypt",1
16-04-2022,Grand Vishu celebrations in Kolkata after two Covid pandemic years,1
16-04-2022,Only Sikh family in German county opens home for war refugees,1
18-04-2022,BSF salutes Major’s role in Mukti Bahini formation and Bangla Liberation War,1
18-04-2022,Tata Steel to consider stock split,2
19-04-2022,"Sensex sinks 1,172pts on rate hike fears, FPI exits",0
20-04-2022,"Tata Steel, Thiess to guide in mining ops",1
20-04-2022,"Sensex dips 704 points on war, rate hike fears",0
20-04-2022,Bias’s 150 helps Tata SC put up 439-6,1
20-04-2022,TMC war of words over Lake Gardens clash,1
20-04-2022,Bhopal hospitals reel under staff crunch amid Covid pandemic,1
20-04-2022,Food prices drive up inflation,0
22-04-2022,Sensex up 874 pts as RIL gains on upgrade by MS,2
22-04-2022,Sebi asks former NSE MD to pay up ₹2-crore fine,1
23-04-2022,"Pandemic has shed light on the benefits of ayurvedic medicine, says Sudhakar",1
23-04-2022,Sensex falls 715 pts after 2-day rally,0
25-04-2022,"2 months on, medical students pin hopes on Indian govt help, end to Ukraine war",1
25-04-2022,Double-digit inflation for a year: 6th spell since 1953 & 1st in 25 years,0
26-04-2022,Sensex loses 617 pts more on global cues,0
26-04-2022,Tata Steel installs ambient air quality monitoring device at Jharia office,1
26-04-2022,Tata Motors regularizes services of over 100 staff,1
28-04-2022,15 lakh children enrolled in Karnataka’s rural libraries during pandemic,1
29-04-2022,War of words over canal-dredging,1
30-04-2022,Pune Mahanagar Parivahan Mahamandal Ltd cites pandemic for poor upkeep of BRTS stops,1
30-04-2022,North Karnataka districts gear up to face fourth wave of Covid pandemic,0
30-04-2022,"With Russia-Ukraine war still on, edible oil crisis to worsen",0
03-05-2022,Ukraine's Zelenskyy says Russia forgot World War Two lessons,1
04-05-2022,Eid-ul-Fitr celebrated with pomp & gaiety after pandemic hiatus,1
04-05-2022,Patna centre of Tata Institute of Social Sciences closed 6 years after inception due to ‘lack of govt support’,1
04-05-2022,"With ₹41,749cr FY22 net, Tata Steel pips TCS as most profitable Tata co",2
04-05-2022,"With Rs 41,749 crore FY22 net, Tata Steel pips TCS as most profitable Tata company",2
05-05-2022,Price pressure forces RBI to step in to tame inflation,1
05-05-2022,"Sensex sinks 1,307 pts on fear of fund outflow",0
05-05-2022,"Sensex sinks 1,307 points on fear of fund outflow",0
06-05-2022,IIM-A survey: Inflation expectations remain high,1
06-05-2022,"Inflation, war force cos to shrink IPOs",1
06-05-2022,"Sensex rises 900 pts, ends flat, ₹ gains 4 days in row",2
06-05-2022,"Inflation, war force companies to shrink IPOs",1
07-05-2022,Sensex falls 867 points on global slump,0
07-05-2022,Infant death registration in Maharashtra falls 20% in pandemic,1
07-05-2022,Tata chairman N Chandrasekaran buys duplex he was renting in skyscraper on Pedder Road for Rs 98 crore,2
08-05-2022,3 injured in gas pipe blast at Tata Steel plant,1
08-05-2022,Techies from Andhra who cheered pandemic homecoming rue decision due to power cuts,1
09-05-2022,Battle-hardened India Inc girds up for inflation war,1
09-05-2022,War of words continues,1
09-05-2022,"At 70, CLT overcomes pandemic but academic pressure on kids a hurdle",1
10-05-2022,Sensex swings 877 points on weak global cues,0
10-05-2022,Bombay & Tata legend Avitus D’Cruz no more,1
10-05-2022,"₹ at historic low of 77.53/$, will add to inflation worries",0
12-05-2022,BSE Q4 net profit climbs two-fold to Rs 71.52 crore,2
13-05-2022,"Perfect storm pulls sensex down 1,158 pts to below 53k",0
13-05-2022,"Retail inflation at 8-year high of 7.8% on food, fuel costs",0
13-05-2022,Rising inflation a crucial challenge for policymakers,1
13-05-2022,"Inflation getting broad-based, RBI set to hike repo by another 1% in FY23: Report",0
14-05-2022,"Sensex swings over 1,100 points",2
15-05-2022,"Goa CM meets Tata chief, discusses investment in state",1
15-05-2022,Tata Marcopolo workers call off strike,0
15-05-2022,Latest inflation data sparked action to tame wheat prices,1
16-05-2022,Summer camps go innovative after pandemic break,1
16-05-2022,Some states feel the pinch of inflation more,0
17-05-2022,Russia’s war cuts diamond work week in Surat to 4 days,1
17-05-2022,Russia war dulls Gujarat diamond work,1
17-05-2022,"Jeff Bezos, White House battle over taxes and inflation",1
18-05-2022,Startup gets further Ratan Tata backing,2
18-05-2022,"‘After pandemic, Ukraine war affected semiconductor industry’",1
18-05-2022,"Sensex up 1,345 pts in relief rally, regains 54k",2
18-05-2022,"WPI inflation at 9-year high of 15.1%, 13th month of double-digit rise",0
19-05-2022,"Tata e-bus bid snub: BEST, co get HC notice",1
20-05-2022,Tata must provide civic amenities in non-command areas: Jharkhand MLA,1
20-05-2022,NSIL Sat for Tata Play takes off for French Guiana on IAF’s C-17,1
20-05-2022,Reinforces ethics of judiciary: Ratan Tata,1
20-05-2022,NSIL Sat for Tata Play takes off on IAF's C-17s,1
21-05-2022,Spl course for pupils who missed e-classes during pandemic,1
23-05-2022,Automobile franchise fined for delay in getting motorcycle RC,1
24-05-2022,"‘Except Japan, advanced ecos’ inflation is over 7%’",0
25-05-2022,"Increase in inflation not just due to fuel price rise, says ex-RBI guv",1
25-05-2022,Tata Motors’ Chikhali plant to get largest solar project,2
25-05-2022,Tata Cap Growth Fund to invest in Aarthi Scans,1
26-05-2022,High inflation may delay rejig of GST rates,0
27-05-2022,Tata Power’s 100MW solar project in state,1
27-05-2022,World Bank's Malpass says war in Ukraine may trigger global recession,1
28-05-2022,Persistence of high inflation forces central bks to up rates,1
29-05-2022,Tata Motors questions e-bus contract to rival bidder,1
29-05-2022,Tata Motors gets Gujarat nod to take over Ford's Sanand plant,2
29-05-2022,NIFTy idea: Bubble wrap waste to burst,1
30-05-2022,Left parties protest against inflation,1
30-05-2022,"YSRC, TDP activists launch flexi banner war to claim NTR legacy in Penamaluru",1
31-05-2022,Tamil Nadu sanctions Rs 50 crore to clear backlog of pandemic claims,1
31-05-2022,"Sensex surges 1,000 points as China eases curbs, monsoon arrives",2
31-05-2022,"After pandemic delay, rush for cataract surgery in Kolkata",1
31-05-2022,Trumped pandemic blues to ace toughest test,1
31-05-2022,"Sensex surges 1k pts as China eases curbs, monsoon arrives",2
02-06-2022,"External affairs minister to visit Slovakia, Czech Republic amid Ukraine war",1
02-06-2022,Tata Motors beats Hyundai to become No. 2 carmaker,2
02-06-2022,100 days of war in Ukraine: A timeline,1
02-06-2022,Footballer dies of 16 stab wounds in Vijayawada gang war,1
03-06-2022,Russia controlling 'fifth of Ukraine' as war enters 100th day,1
03-06-2022,India has taken balanced stand on war in Ukraine: Bhagwat,1
03-06-2022,‘Fat finger’ trade on NSE may have cost broker ₹250 crore loss,1
03-06-2022,"India May services growth at 11-year high, input inflation at record",1
03-06-2022,Inflation expectations stay high: BIES,0
03-06-2022,"Tata Projects to build Noida Airport, beats L&T & Shapoorji Pallonji",2
03-06-2022,"Sensex rallies 566 points in early trade on buying in Reliance, IT stocks",2
04-06-2022,Tata moves Gujarat HC against farmer 'tilting at windmill',1
04-06-2022,Tata Projects bags contract to build Noida International Airport,2
04-06-2022,NSE warns brokers to be alert for ‘fat finger’ trades,1
05-06-2022,Cancer treatment & beyond: Tata Hosp rebuilds kids’ lives,1
06-06-2022,World War II veterans honored a day before D-Day anniversary,1
06-06-2022,"Sensex slides 227 points in early trade; Nifty falls to 16,517 level",0
06-06-2022,Inflation and rate hike: Hit felt across asset classes,1
07-06-2022,Two sisters trafficked from Jharkhand during pandemic rescued,1
08-06-2022,"Jaguar hits 3 rickshaw pullers, drags one of them for 20m",1
08-06-2022,Tata Motors to Bombay HC: BEST must be made to call new e-bus bids,1
08-06-2022,Mumbai: Tata Motors seeks new tender for BEST e-buses’ contract,2
08-06-2022,"Post Covid, pandemic of porn starts among teens",1
09-06-2022,RBI raises inflation forecast to 6.7% from 5.7% for FY23,0
10-06-2022,"US stocks tumble as rate pressures grow, inflation report looms",0
11-06-2022,"Sensex dives 1,017 points on global selloff, Covid cases",0
11-06-2022,"Sensex dives 1,017 pts on global selloff, Covid cases",0
12-06-2022,Kolkata gets set to fly high in a war machine,1
12-06-2022,Tata conferred honorary D.Litt.,1
15-06-2022,"Wholesale price index inflation at record high of 15.9% on costly food, fuel",0
16-06-2022,"BSE, NSE get Sebi notice on penalties",1
16-06-2022,"BSE, NSE get Sebi notice on penalties",1
16-06-2022,"Maharashtra: After 2 tough pandemic years, Yeola’s Paithani saree sales flourishing again",1
16-06-2022,Stocks hold gains after Federal Reserve hikes rates to fight inflation,2
20-06-2022,Economic uncertainty during pandemic lowers birth rate,1
21-06-2022,West Bengal: Pandemic shadow over school transport as some start outsourcing bus services,1
21-06-2022,"Telangana inflation rate spirals to 9.45% in May, highest in India",0
22-06-2022,"Sensex gains 934 points in relief rally, but market still cautious",2
22-06-2022,"Sensex gains 934 pts in relief rally, but mkt still cautious",2
23-06-2022,RBI deputy governor wants repo over next year’s inflation rate,1
23-06-2022,"NSIL’s satellite for Tata Play, GSAT-24, launched by Arianespace",1
23-06-2022,RBI dy governor wants repo over next year's inflation rate,1
23-06-2022,"India's GSAT-24 satellite launched, entire capacity leased to Tata Play",1
23-06-2022,Tata sets up 150 EV charging points with green fuel in Mumbai,2
24-06-2022,"Inflation over 6% hurts growth... It has become broad-based and RBI is addressing it, says Das",0
24-06-2022,"GSAT-24, dedicated sat for Tata Play by NSIL launched",1
27-06-2022,Zelenskyy to press G7 for more help as war rages,1
28-06-2022,Persistent inflation willhit demand: Chandra,1
28-06-2022,Telangana with high per capita income sees dipping poverty graph during pandemic,1
01-07-2022,"Rupee, sensex see worst quarter since Covid",0
02-07-2022,"Inflation in Pakistan stands at 21.3%, highest in 13 years",1
02-07-2022,City shrugs off pandemic blues with khuti pujas,1
04-07-2022,"Share Market: HDFC Bank, Tata Sons and other stocks in news today",1
06-07-2022,Tata Motors can bid for electric buses if BEST floats fresh tender: Bombay HC,1
06-07-2022,NSE case: ED quizzes Mumbai ex-top cop,1
06-07-2022,"Tata Motors, Biocon, Tata Steel and oother stocks in news today",1
07-07-2022,Sensex rises 2k pts from June low as crude cools,2
07-07-2022,"Sensex rises 2,000 points from June low as crude cools",2
07-07-2022,US ‘Memorial Wall’ honour for JRD Tata,1
08-07-2022,"Tata Projects execs, Power Grid official held in graft case",1
10-07-2022,Inflation may ease in second half of 2022-23: RBI governor,2
12-07-2022,Toxic briefing war against Rishi Sunak now emanating from rival Tory party factions,1
13-07-2022,India’s poor face low inflation risk: UN,1
18-07-2022,Sebi clears BSE chief Chauhan as NSE’s CEO,1
18-07-2022,"Tata Motors hikes prices again, cites increased input costs",2
19-07-2022,"Global cues, FPI buying help sensex rise 760 points",2
20-07-2022,ED arrests Mumbai ex-top cop in NSE phone tapping case,1
20-07-2022,"Double trouble for students with weaker rupee, US inflation spike",0
20-07-2022,"iSec hired to analyse NSE staff calls, not record: Retired Mumbai police chief Sanjay Pandey",1
20-07-2022,Ukraine war can hit food security bid: India at UN,1
20-07-2022,A year more for projects stalled in pandemic,1
20-07-2022,"Sensex, Nifty recover after initial drop",2
20-07-2022,"iSec hired to analyse NSE staff calls, not record: Ex-CP",1
22-07-2022,Tata Consumer Products bets big on recently launched plant-based meat range,1
22-07-2022,PM loans: Only 9% hit by pandemic return for top-up in Noida,1
23-07-2022,Performance dips in CBSE exam due to Covid pandemic,1
23-07-2022,"Tata Motors bags tender to provide 1,500 e-buses to Delhi Transport Corporation",2
28-07-2022,West Bengal Government to start legal process to take over idle Hindustan Motors factory land: CM Mamata Banerjee,1
28-07-2022,"Jaguar Land Rover drives Tata Motors into a Rs 5,000 cr loss",0
28-07-2022,Maharashtra CM Eknath Shinde calls on Ratan Tata,1
29-07-2022,"Sensex soars 1,041 pts to nearly 3-month high",2
29-07-2022,"Sensex soars 1,041 points to nearly 3-month high",2
30-07-2022,Sensex ends at 3-month high,2
03-08-2022,Russia accuses US of direct Ukraine war role,1
03-08-2022,"Govt, RBI trying to keep inflation under 6%: Finance minister",1
04-08-2022,"Post-Covid, inflation hits health, motor covers",2
04-08-2022,"Post-Covid, inflation hits health, motor covers",2
04-08-2022,Grand start to annual Vasco saptah after 2-year pandemic gap,1
05-08-2022,"Tata Power to have 1,500 e-charging stns in state",1
05-08-2022,"Aurangabad: 5 men strike 2 automobile showrooms, flee with Rs 15 lakh",1
07-08-2022,"1,900 children quit school in Mumbai Metropolitan Region amid pandemic",1
08-08-2022,War of words: Does Binance own WazirX?,1
08-08-2022,Tata Motors to buy Ford India's manufacturing plant for $91 million,2
08-08-2022,"Kolkata: 19-year-old driver revving Jaguar loses control, kills 40-year-old",1
08-08-2022,War of words: Does Binance own WazirX?,1
10-08-2022,Kolkata school organises first soccer meet after pandemic,1
10-08-2022,Tata Sons profit more than doubles in FY22,2
10-08-2022,Tata Sons profit more than doubles in FY22,2
10-08-2022,Russia launches Iranian satellite amid Ukraine war concerns,1
11-08-2022,"Post Covid, Tata Mumbai Marathon is back with a bang",1
11-08-2022,Apparel retailers to see 21-23% revenue growth this fiscal despite inflation impacting demand,1
11-08-2022,US inflation eases to 8.5% in July as energy costs dip,2
12-08-2022,Sensex back above 59k as slower US inflation lifts global markets,2
12-08-2022,Government hopes inflation eases to 6% on lower int’l prices,2
12-08-2022,2 police wings merged for war on drugs: Tamil Nadu CM M K Stalin,1
12-08-2022,"Sensex back above 59,000 as slower US inflation lifts global markets",2
13-08-2022,Retail inflation moderates to 5 month low of 6.7% in July,2
15-08-2022,Indore: Bridge courses for students to overcome pandemic gap,1
15-08-2022,99.5% of train operations prior to pandemic restored: South Western Railway,1
16-08-2022,Markets trade firm; sensex climbs over 395 points in early trade,2
16-08-2022,Two flagship Tata Trusts may end up with separate heads,1
17-08-2022,Tata backs co that links senior citizens & ‘grandkids’,1
17-08-2022,Draft of global pandemic treaty to be available in next 18 months: WHO scientist Soumya,1
17-08-2022,"Easing inflation will improve economy, says SBI chairman",2
17-08-2022,"Easing inflation to help eco, says SBI chief",2
17-08-2022,"Sensex gains 379 pts, nears 60k again on global, domestic cues",2
17-08-2022,WHO: Global pandemic treaty draft to be ready in 18 months,1
17-08-2022,WPI inflation eases to 5-mth low of 13.9%,2
18-08-2022,UK inflation in double digits after 40 years,1
18-08-2022,"Satyajit Ray films overcome war hurdle, reach Moscow",1
18-08-2022,US delegation lauds India's efforts during pandemic,1
18-08-2022,"Sensex regains 60k on FII inflows, falling crude price",2
18-08-2022,Pandemic opened pharma industry’s eyes to tech: Saama,1
20-08-2022,"Growth, inflation worries for FY23 reducing: Finmin",1
20-08-2022,"Sensex snaps 5-day rally, sees marginal weekly gain",1
20-08-2022,"RBI says inflation easing, but uncertainty still looms",2
20-08-2022,"RBI says inflation easing, but uncertainty still looms",2
23-08-2022,"Sensex back at 58k on weak global cues, profit-booking",2
23-08-2022,"Sensex back at 58k on weak global cues, profit-booking",2
23-08-2022,"Infosys, TCS, Tata Power and other stocks in news today",1
24-08-2022,"Inflation peaked at 7.8%, 4% target by FY24: RBI governor Shaktikanta Das",0
24-08-2022,"West Bengal PCB sets up war room to fight air, noise pollution",1
24-08-2022,"Inflation peaked at 7.8%, 4% target by FY24: RBI governor",0
25-08-2022,"Maruti Suzuki, Tata Power and other stocks in news today",1
26-08-2022,Bhopal Automobile Dealers' Association head becomes Federation Of Automobile Dealers chairman,1
26-08-2022,"13% dip in tax collection, 51% rise in market borrowings in pandemic year, says CAG",1
28-08-2022,Tata Steel aims to double domestic crude steel prod,1
28-08-2022,Programme to honour war veterans,1
29-08-2022,"US Fed’s tough fight on inflation unnerves D-St traders, investors",0
29-08-2022,"US Fed’s tough fight on inflation unnerves D-St traders, investors",0
30-08-2022,Sensex tanks 861 pts as FIIs turn net sellers,0
30-08-2022,Sensex tanks 861 pts as FIIs turn net sellers,0
30-08-2022,"Nagpur: From an epic war to bypass story, unique blend of arts",1
30-08-2022,Delhi court junks bail plea of NSE ex-chief Chitra Ramkrishna,1
31-08-2022,"Kadiyam Srihari, Thatikonda Rajaiah spat turns ugly in Telangana Rashtra Samithi war of words",1
31-08-2022,"Sensex jumps 1,564 pts to 59.5k as FPIs buy again",2
31-08-2022,"Tata Sons AGM votes to have separate chiefs for company, Trusts",1
31-08-2022,"Tata Sons AGM votes to haveseparate chiefs for co, Trusts",1
31-08-2022,"Sensex jumps 1,564 pts to 59.5k as FPIs buy again",2
31-08-2022,Mikhail Gorbachev ended Cold War but presided over Soviet collapse,1
