Date,news,output
13-08-2021,"Retail inflation at 3-month low in July, June factory output up 13.6%",1
13-08-2021,"New Uttar Pradesh companies to get priority in BSE, NSE listings",1
13-08-2021,Tata Steel appoints Khambata on board,1
14-08-2021,Premier Explosives begins shipping rocket motors to Israel,1
14-08-2021,India can emerge as global tech leader: Tata Sons chairman,1
14-08-2021,"Sensex surges 7,700 points in 7 months to scale 55k peak",2
16-08-2021,"WPI inflation eases to 11.16% in July; food, crude prices soften",2
16-08-2021,"Sensex, Nifty unchanged as metals offset losses in energy stocks",1
16-08-2021,Karnataka: Farmers fear pandemic could wipe off smiles floriculture gave them,1
16-08-2021,NSE records over 50 lakh new investors since April,2
19-08-2021,"Sensex hits 56k, but ends lower",0
20-08-2021,"Karvy scam: 1,300 Hyderabad clients complained to NSE",1
21-08-2021,Sensex slides on taper talks,0
25-08-2021,Tata foundation rolls out trekking expeditions to Ladakh,1
26-08-2021,Pandemic worsens fund woes of Madurai corpn’s first shelter,1
26-08-2021,Tata Sons FY21 profit up over 2x on TCS buyback,2
27-08-2021,"Govt to announce PLI scheme for automobile sector, allocate Rs 57,000 cr",2
28-08-2021,Corneal transplants down by 52% as eye donations hit by pandemic,1
28-08-2021,"Sensex closes above 56k on eco outlook, rupee strength",2
29-08-2021,Govt school teachers are the unsung warriors of this pandemic,1
31-08-2021,"Sensex, Nifty hit records on dovish US Fed comments",2
01-09-2021,"Bull run: Another day of sensex, Nifty highs",2
01-09-2021,UP economy on fast track despite pandemic jolts,1
03-09-2021,Pandemic boosted e-transactions in a way even demonetization couldn’t,1
03-09-2021,"Gautam Navlakha will be taken to Tata hospital for tests, Bombay HC told",1
04-09-2021,"Sensex breaches 58,000 on RIL push",2
05-09-2021,New school of thought! Teachers in Maharashtra take education to poor kids in pandemic,1
05-09-2021,Mumbai: New school of thought! Teachers take edu to poor kids in pandemic,1
10-09-2021,"Mumbai: Tata Power, Lodha plan charging stations",1
11-09-2021,Pandemic Hurts Poor Kids’ Chances To Study,1
13-09-2021,"Mumbai: Tata Memorial Centre sees shortage of blood, asks for donations",1
15-09-2021,NSE probes freak F&O trades,1
16-09-2021,"Tata Sons, group led by SpiceJet chief bid for Air India",2
16-09-2021,Gujarat: Cyber crimes spiked 64% during Covid-19 pandemic,1
16-09-2021,Tata Consumer Products to ink MoU with IIMR,1
16-09-2021,Tata Sons denies management rejig plan,1
17-09-2021,Pune: Wada occupants try to hold on to traditions during pandemic,1
17-09-2021,Inflation seen easing to 4% by FY24: RBI deputy governor,2
18-09-2021,Pandemic fear: College hostels in Coimbatore under scanner,1
20-09-2021,Justin Trudeau future on the line as Canadians vote in pandemic election,1
20-09-2021,Mega war on vector-borne diseases today in Ahmedabad,1
21-09-2021,Pandemic study reveals lack of trained health personnel,1
22-09-2021,Army expedition to mark golden jubilee of 1971 war,1
22-09-2021,21L new investors on BSE in a year,2
23-09-2021,Pakistan PM Imran Khan warns of a civil war in Afghanistan,1
24-09-2021,US Fed’s clarity on tapering takes sensex close to 60k,2
25-09-2021,"Mumbai: Tata Power installs 20,000 smart meters, eyes 1 lakh by 2023",1
25-09-2021,Sensex at sixty,2
25-09-2021,HC allows 40% discount to girl who can’t pay school fee due to pandemic,1
25-09-2021,Sensex at sixty,2
28-09-2021,Mumbai: Number of elderly ending lives soars 31% in pandemic year,1
29-09-2021,"If US had kept 2,500 troops in Afghanistan, war would result: White House",1
01-10-2021,"Army team completes 1,300 km cycleexpedition to mark 1971 war win",1
01-10-2021,"New water pipelines, motors to boost supply in Dhayari, Raikar Mala",1
01-10-2021,Tata Steel sells Singapore unit NatSteel,2
01-10-2021,"Toddlers at home, 70% preschools shut down during pandemic in Ahmedabad",1
04-10-2021,"Isro commercial arm NSIL to launch first ‘demand-driven’ satellite, will lease it to Tata Sky",1
04-10-2021,Maharashtra: Rs 41 crore pandemic aid given to 66k construction site workers,1
07-10-2021,"Bengaluru: Diesel closes in on Rs 100/litre, transporters warn of inflation",0
07-10-2021,"Rising crude gives markets jitters, pulls sensex down, rupee near 6-month low of Rs 75 per dollar",0
07-10-2021,Pandemic could have long-term impact on kids’ mental health,1
08-10-2021,Tata Motors to raise $1 billion to push EV play,2
09-10-2021,Prashant Kishor’s tweet sparks war of words between TMC & Congress,1
09-10-2021,Tata companies add Rs 1 lakh crore mcap since mid-September,2
09-10-2021,Tata cos add Rs 1L cr mcap since mid-Sept,2
10-10-2021,Praful Patel hails move to sell AI to Tata,2
10-10-2021,Pandemic forced lakhs to seek mental health support in Maharashtra,1
10-10-2021,"Tata Power warns Delhi of outages, cites coal shortage",1
11-10-2021,RK Singh reads the riot act to Tata Power on blackout bogey,1
12-10-2021,"Nifty vrooms past 18k for 1st time on auto, power stocks, ends lower",2
12-10-2021,Arthritis complications see rise after let-up in pandemic,1
12-10-2021,Admin takes steps to ensure safe puja amid pandemic,1
12-10-2021,"Citing pandemic losses, many traders stay open in Aurangabad",1
13-10-2021,"Retail inflation at 5-month low in September, IIP up 11.9% in August",2
14-10-2021,"After Ladakh, India-China war of words on Naidu’s Arunachal trip",0
14-10-2021,"E-surge for Tata stocks, sensex at new peak too",2
14-10-2021,Kolhapur: MSRTC union blames salary delays as 24th staffer ends life since pandemic,1
14-10-2021,"Delhi: With pandemic in lead role, dhakis miss the beat for another season",1
15-10-2021,Sensex goes past 61k as festive mood grips D-St,2
15-10-2021,Mumbai: When will the Covid pandemic evolve to being endemic,1
15-10-2021,Sensex goes past 61k as festive mood grips D-St,2
15-10-2021,September wholesale inflation dips to 6-month low,2
16-10-2021,"The pandemic was challenging both emotionally and financially, says Rohit Khurana",1
16-10-2021,Childline sees rise in complaints directly from kids since start of pandemic,1
19-10-2021,Tata AIG rolls out drone insurance,1
19-10-2021,"Sensex up for 7th day, nears 62k",2
20-10-2021,No new daily Covid cases for first time in pandemic in Vadodara,2
20-10-2021,"Sawant, Aleixo in war of words over forensic univ land",1
20-10-2021,"Sensex scales 62k on volatile day, gains 12k points in 9 months",2
20-10-2021,HUL’s Q2 profit rises 9% amid high inflation,1
21-10-2021,Pandemic hasn’t held these postal employees back from doing job,1
21-10-2021,Tatas to shift ready-to-eat biz to Tata Consumer,1
21-10-2021,Tatas to shift ready-to-eat biz to Tata Consumer,1
24-10-2021,Eye on Indo-Pacific: Indian & UK Navies in war games,1
24-10-2021,"Aides of Captain Amarinder, Sidhu in Twitter war over ex-CM’s Pakistan friend",1
25-10-2021,"Tatas Motors to invest Rs 15,000 crore in electric vehicles",2
25-10-2021,Maharashtra: College trustee donates Rs 50 lakh to Tata Hospital for flouting norms,1
26-10-2021,Mumbai: Tata crosses 1k EV charge points,2
29-10-2021,"Sensex crashes 1k points, below 60k",0
29-10-2021,Senior PI shunted for shielding goons in gang war,1
29-10-2021,Sensex crashes 1k pts on FPI selling,0
29-10-2021,Tata Motors launches 21 new models and variants as CV demand picks up after 2 years,2
29-10-2021,Tata Consumer Products to transition ‘Tata Cha’ business to Indian Hotels Company,1
01-11-2021,B’desh war veteran doc duped of Rs4L by ‘spiritual healers’,1
02-11-2021,Sensex gains 832 pts after 3 days of loss,2
03-11-2021,Northern Army commander interacts with Kargil War Veer Naris,1
03-11-2021,Delay in communication of bail orders should be addressed on war footing: Justice Chandrachud,1
04-11-2021,"Sensex ends Samvat 2077 38% higher, best in 12 years",2
05-11-2021,Inflation at 13-year high in OECD area,1
05-11-2021,"US stocks: S&P 500, Nasdaq extend record streaks",2
10-11-2021,"Madurai doctors use tech to treat 40,000 patients during pandemic",1
10-11-2021,Cyber crime cases highest in Covid pandemic period: RTI query,1
10-11-2021,256 Karnataka kids found homes in 2020-21 in the midst of pandemic,1
11-11-2021,Tax cuts on fuel improve inflation outlook: RBI governor,2
13-11-2021,"Retail inflation up at 4.5% in October, IIP slows in September",0
13-11-2021,Tata Consumer to buy Tata Q from group co,1
16-11-2021,"All must get ‘mini pad for life’, says Tata Group chairman at special AMU convocation",1
16-11-2021,Healthcare sector’s share in Gujarat’s CSR spend jumps to 55% after pandemic,1
17-11-2021,NIFT Delhi hosts its first physical convocation amid pandemic,1
18-11-2021,JMM protests outside Tata Factories in Jamshedpur,0
20-11-2021,"Delhi inflation lowest among metros, says deputy CM Manish Sisodia",1
20-11-2021,Pandemic pushed 60% students into child labour,1
20-11-2021,"Pandemic turning into endemic in Chandigarh, feel experts",1
22-11-2021,Gujarat’s stock investors on BSE set to touch 1 crore-mark,2
22-11-2021,A stark view of the post pandemic world on stage,1
23-11-2021,"Automobile breaking market crackdown: Another major player falls in police net, property worth Rs 10cr seized",1
23-11-2021,Tamil Nadu on mission to retrieve education lost in pandemic,1
23-11-2021,"RIL slides on Aramco deal review, triggers 1,  1 70-point sensex crash",0
24-11-2021,"RIL, Bharti help sensex regain 1k pts",2
24-11-2021,"In pandemic times, every viral pneumonia not Covid positive!",1
25-11-2021,Automobile bizman held in cheating case,1
27-11-2021,"Sensex plunges 1,688 points as new virus variant spooks global markets",0
28-11-2021,"Post pandemic break, winter bird count back in Delhi-NCR to take stock of species",1
30-11-2021,Mumbai: BMC’s war rooms gear up to battle Omicron,1
30-11-2021,"RIL, Kotak help sensex gain 153 pts",2
30-11-2021,Nasdaq suspends trading in Twitter as CEO steps down,1
30-11-2021,"Clear Yudh Samman Scheme to honour EC/SCC Pak war veterans, Patiala MP writes to Rajnath",1
30-11-2021,"Omicron risk very high, may change pandemic course: WHO",0
01-12-2021,Nov ends up best ever month in pandemic after Apirl 2020 for Vid,1
01-12-2021,"Maharashtra may have missed 10,000 new HIV cases in pandemic year",1
02-12-2021,Unsafe for Frontier Gandhi’s kin to visit Pak during pandemic in Mumbai: HC,1
02-12-2021,Sensex up 620 points on robust Q2 GDP growth,2
02-12-2021,Sensex up 620 pts on robust Q2 GDP growth,2
02-12-2021,World War II veteran to get arrears within six months with 8% pa interest: AFT,1
03-12-2021,"Uttar Pradesh: Covid pandemic migration trauma worse than partition, says Akhilesh Yadav",1
03-12-2021,Sensex up 1.4k pts in 2 days as desi funds step up buying,2
03-12-2021,"Sensex up 1,400 points in 2 days as desi funds step up buying",2
05-12-2021,Bangladesh war veterans recall testing times from 1971 battleground,1
06-12-2021,Jharkhand: Tata Steel hires 14 transgenders as heavy machinery operators,1
07-12-2021,Ex-Armymen to observe 50th anniv of 1971 war,1
07-12-2021,"Sensex dives 949 pts over inflation, Omicron worries",0
08-12-2021,Sensex rebounds 887 pts as Omicron fears recede,2
09-12-2021,"Sensex surges 1,016 pts on RBI move, US rally",2
09-12-2021,"Sensex surges 1,016 pts on RBI move, US rally",2
09-12-2021,Jaisalmer admn to host half marathon at Longewala war area on Dec 25,1
09-12-2021,"Overarching priority is growth, inflation a concern: RBI guv Das",1
14-12-2021,Tata Cha outlets to be known as Qmin,1
14-12-2021,HC: Maharashtra was pioneer in tackling pandemic,1
14-12-2021,War of words between Cong and BJP ahead of MLC poll result,1
15-12-2021,"In ‘a first’, Tata Power installs submersible substation in Delhi",2
16-12-2021,Fed sees three rate hikes in 2022 as inflation battle begins,1
16-12-2021,Rs 17cr accident insurance claims paid in Guj since pandemic,1
18-12-2021,"Sensex falls 889 pts on Fed move, biggest FPI selloff since March ’20",0
18-12-2021,Cong minister boasts about Gehlot’s ‘noble’ governance during Pandemic,1
18-12-2021,Delhi: Tata Power to conduct Lok Adalat on theft cases,1
21-12-2021,Monday blues: Stocks of city cos sink as Sensex tanks,0
21-12-2021,"Sensex sinks 1,200 points on global selloff over Omicron",0
22-12-2021,Sensex up 497 points amid volatility,2
22-12-2021,"Revive Covid curbs, activate war rooms: Centre to states",1
23-12-2021,Mumbai: 22 trees cut in Parel for Tata Memorial hospital,1
27-12-2021,80% cabs stopped plying during pandemic,0
27-12-2021,Telangana: School managements discuss ways to overcome pandemic challenges,1
28-12-2021,Telangana: Rachakonda sees rise in crime rate after pandemic lull,1
28-12-2021,Gujarat: Tata Group to set up hotel near Statue of Unity,2
28-12-2021,"50 years on, veteran revisits 1971 Indo-Pak war that cost him an eye",1
28-12-2021,Tata Group chairman N Chandrasekaran lists 4 themes for Tata Group for next year,1
29-12-2021,SBI Foundation supports CCMB in setting up CoE for Genomics Guided Pandemic Prevention,1
30-12-2021,"In pandemic yr, MP earned 12,400cr in taxes on fuel",1
01-01-2022,Sensex gains 22% in 2021 to end over 58k,2
01-01-2022,Sensex gains 22% in 2021 to end over 58k,2
03-01-2022,"Telangana: BJP, police in tug of war over Bandi Sanjay’s GO 317 stir",1
04-01-2022,Kolkata: Metro footfall dips as pandemic curbs set in,1
04-01-2022,"Sensex starts 2022 with a bang, gains 929 pts to 59k",2
04-01-2022,"Sensex starts 2022 with a bang, gains 929 points to 59,000",2
04-01-2022,"Sensex starts 2022 with a bang, gains 929 pts to 59k",2
05-01-2022,"Sensex up for 3rd day, nears 60k level again",2
05-01-2022,"Twitter war between Cong, BJP",1
06-01-2022,"1,500 jail inmates released on parole, bail in pandemic",1
06-01-2022,Karnataka: Property revenue exceeds target in 2021 amid pandemic pressure,1
06-01-2022,Sensex reclaims 60k after 4-day rally,2
06-01-2022,"15,014: Most daily Covid cases in Mumbai since pandemic began",1
07-01-2022,"Sensex falls 621 points on hawkish US Fed, Omicron",0
07-01-2022,"Sensex falls 621 points on hawkish US Fed, Omicron",0
08-01-2022,Tata Consumer Products to focus on value-add product extensions: CEO,2
08-01-2022,Tata Consumer Products to focus on value-add product extensions: CEO,2
08-01-2022,Karnataka Covid war room wins Centre’s award for use of tech,1
08-01-2022,8 war rooms to be set up in Nashik,1
09-01-2022,24x7 Covid war room gets activated in Kolhapur district,1
09-01-2022,Jaisalmer military war museum shut to prevent spread of virus,1
10-01-2022,Gang war creates panic,1
10-01-2022,Covid-19: West Bengal’s daily case surge smashes pandemic record,1
10-01-2022,Equestrian sports help youngsters get outdoor action this pandemic,1
12-01-2022,Cyber harassment cases see upswing in pandemic,1
12-01-2022,"Govt set to become largest shareholder in Vodafone Idea, get stake in Tata Tele",2
12-01-2022,Federal Reserve chief Jerome Powell pledges to fight inflation in second term,1
12-01-2022,"The pandemic taught me to value relationships, keep people close & love them dearly: Zakir Khan",1
13-01-2022,"US inflation 'too high,' lowering it a priority: Fed's Brainard",0
13-01-2022,"US inflation 'too high,' lowering it a priority: Fed's Brainard",0
13-01-2022,Gujarat fails to reimburse schools for girls’ fee waiver in pandemic years,1
13-01-2022,Maharashtra: Rs 207 crore netted in fines since the pandemic began in 2020,1
13-01-2022,"Sensex crosses 61k mark again, mcap at 280L cr",2
13-01-2022,"Stocks up, dollar down; US inflation data surges as forecast",2
13-01-2022,"Stocks up, dollar down; US inflation data surges as forecast",2
13-01-2022,"Sensex crosses 61,000 mark again, BSE mcap hits Rs 280 lakh crore",2
13-01-2022,PIB’s tweet on Vivekananda and 1857 freedom war stuns experts,1
14-01-2022,Prayagraj: Magh Mela begins today in shadow of pandemic,1
14-01-2022,"Ahead of polls, SP sets up IT war room to connect with voters digitally",1
14-01-2022,Pandemic crunch: Ahmedabad's Sundarvan zoo raising funds,1
14-01-2022,"Record US inflation growing concern for Fed, business",0
14-01-2022,"Record US inflation growing concern for Fed, business",0
15-01-2022,"Builder occupied war hero’s land, booked",1
15-01-2022,Pandemic casts shadow on Sankranti festivities,1
16-01-2022,Pandemic triggered loneliness in elderly: Study,1
16-01-2022,"Tamil Nadu: AIADMK calls for war on ‘corrupt, dynastic’ DMK rule",1
17-01-2022,Congress's 20 Uttarakhand seats caught in Rawat-rival tug of war,1
18-01-2022,Bengaluru: Pandemic fuels dip in takers for auto permits,1
18-01-2022,"Auto, energy stocks drive sensex gains",2
19-01-2022,HC junks Tata Power plea to exit NTPC pact for sourcing electricity,0
19-01-2022,More than 150 cops in Visakhapatnam hit by pandemic,1
19-01-2022,"Karnataka: Fever clinics, Covid war rooms to come up in villages",1
19-01-2022,Sensex tanks nearly 1% on global cues,2
19-01-2022,More than 150 cops in Vizag hit by pandemic,1
20-01-2022,Tata Power to move CERC over move to exit pact with NTPC,2
20-01-2022,NSE top derivatives trading exchange globally,2
20-01-2022,"Rising US yields, crude prices spook St, sensex dips 656 pts",0
20-01-2022,NSE top in derivatives globally,2
21-01-2022,"Sensex tanks 634 points, loses 1.8k in 3 days",0
21-01-2022,"HUL Q3 net up 17% at Rs 2,243cr amid inflation",2
21-01-2022,"HUL Q3 net up 17% at ₹2,243cr amid inflation",2
21-01-2022,"Sensex tanks 634 pts, loses 1.8k in 3 days",0
21-01-2022,"Amar Jawan Jyoti to be put out, ‘merged’ with flame at National War Memorial",1
22-01-2022,Shilpa Shetty shares a post about 'Letting go': Lose some battles to win the war,1
22-01-2022,"Andhra Pradesh: V Vijayasai Reddy heckles rebel MP, war of words escalates on Twitter",1
23-01-2022,"Pune: From war of words to fisticuffs, all because of the humble mask",1
24-01-2022,Assam Baibhav award for Ratan Tata,2
24-01-2022,"As pandemic lingers, schools go to forgotten students in hour of need",1
24-01-2022,"Rate of hospitalisation drops below 1%, lowest in pandemic",1
25-01-2022,Pune: Covid pandemic plays spoilsport for couples this year too,1
25-01-2022,Netaji legacy: BJP-TMC war of words on,1
25-01-2022,"Delhi: BJP, AAP in a war of words over Lokpal issue",1
25-01-2022,"Won’t defer civic polls, but monitor it for pandemic protocol: Madras HC",1
25-01-2022,"Sensex dives 1.5k pts on selling by foreign funds, LTCG rumour",2
25-01-2022,Pandemic effect: General medicine gets an edge in Karnataka colleges,1
25-01-2022,"Sensex dives 1,500 points on selling by foreign funds",2
26-01-2022,Automobile industry’s semiconductor crisis is exacerbated by use of older generation chips,2
26-01-2022,Union Budget 2022: Households wrestle with inflation as incomes dip,0
26-01-2022,60% of police awards go to J&K amid war on terror,1
26-01-2022,"After 5-day losing streak, sensex sees bounceback",2
26-01-2022,Pandemic hits tricolour sales in Jaipur,1
26-01-2022,"After 5-day losing streak, sensex sees bounceback",2
27-01-2022,"Fed says US interest rates could rise in March, Powell expects inflation to fall this year",2
27-01-2022,Wellness vacays see rise in popularity amid pandemic stress,1
27-01-2022,Tata Steel Masters: R Praggnanandhaa beats Vidit Gujrathi; Carlsen stays in front,2
27-01-2022,No chance of reduction in inflation for another three months: Pak finance minister,1
27-01-2022,"Sensex slumps over 1,100 points in early trade; Nifty falls below 16,950",0
28-01-2022,DK schools gear up for SSLC exam amidst pandemic,1
28-01-2022,DK schools gear up for SSLC exam amidst pandemic,1
28-01-2022,Sensex tanks 581 pts as hawkish Fed roils mkts,2
28-01-2022,Sensex tanks 581 points as Federal Reserve signals rate hike,2
29-01-2022,Bengaluru: Iconic image from World War II being replicated in Padmanabhanagar park,1
29-01-2022,This mth saw highest Covid cases since pandemic began,0
29-01-2022,US warns of war if Russia invades Ukraine,0
29-01-2022,US warns of war if Russia invades Ukraine,0
30-01-2022,Arjun triumphs in Tata Challengers,1
30-01-2022,Audio books link digital education with traditional oral teaching amid pandemic,1
01-02-2022,State signs MoA with Tata Tech to transform 149 ITIs,2
01-02-2022,"3L+ samples tested in a month, max during pandemic",1
01-02-2022,"Delhi: Pandemic adds to anganwadi staff’s woes, protest on for pay",1
01-02-2022,Sensex rallies on growth forecast,1
01-02-2022,"Tata Motor records Rs 1,451 cr consolidated loss in Q3",0
01-02-2022,"Tata Motor records 1,451 crconsolidated loss in Q3",0
02-02-2022,Tata Steel CEO: Budget inclusive,1
03-02-2022,"Prez debate: BJP fields UP MPs; opposition attacks govt on jobs, inflation",1
04-02-2022,Sensex tanks 770 pts on fears of rate hike,2
05-02-2022,Pandemic hits cancer reporting,1
05-02-2022,Indian Air Force’s biggest war drill to be held at Pokhran,1
05-02-2022,Industries raise the bar to combat pandemic,1
06-02-2022,Covid pandemic pulls down AIDS care in Haryana,1
08-02-2022,"Sensex tanks 1,024 points on US rate hike fears, rising crude",2
08-02-2022,‘Icon of partiality’ triggers KTR-BJP social media war,1
08-02-2022,Survey throws light on self-medication during pandemic,1
11-02-2022,Sensex rallies on rates status quo,1
11-02-2022,Chandra set for 2nd term as Tata chief,1
11-02-2022,N Chandrasekaran set for 2nd term as Tata chief,1
11-02-2022,Sensex rallies on rates status quo,1
12-02-2022,Snack choices broaden in pandemic,1
12-02-2022,Sensex joins global selloff over fears of Fed rate hike,1
12-02-2022,Snack choices broaden in pandemic,1
12-02-2022,Chandrasekaran gets 2nd term as Tata Sons chairman,1
12-02-2022,Tata Sons retains Chandra as chairman for 5 more years,1
13-02-2022,"Ukraine jitters, inflation spur gold price to 12.5-month high",0
13-02-2022,"Ma & Pa stores to plumbers, biz took the e-way in pandemic",1
13-02-2022,How ‘Himalayan yogi’ guided ex-MD of NSE,1
14-02-2022,Increase in car sales lessens pandemic blues for auto sector,2
14-02-2022,"This Valentine’s Day, pandemic locked down many happy couples",1
14-02-2022,Chairman of Tata Sons can’t head Tata Trusts,0
15-02-2022,Thiruvananthapuram: Kazhakootam Sainik School on a war footing to regain lost glory,1
15-02-2022,Karnataka governor all praise for BJP govt’s pandemic management,1
15-02-2022,"Retail inflation at 7-month high, double-digit WPI for 10th month",0
15-02-2022,"Sensex falls 1,747 points, steepest in nearly a year",0
15-02-2022,Demand for facial and ab sculpting goes up during COVID-19 pandemic,1
16-02-2022,Madhya Pradesh: Tug of war resumes over 27% OBC reservation,1
16-02-2022,Tata plantation co APPL eyes recovery after 7yrs,2
16-02-2022,Tata hospital raises Rs 75 crore for paediatric cancer patients over 2 years,2
16-02-2022,"Mumbai: Only 988 patients in hospital, among lowest in Covid-19 pandemic",1
16-02-2022,"Sensex seesaw of 3,500 its sixth biggest 2-day swing",0
16-02-2022,"Sensex recovers 1.7k pts as war fears ease, crude slides",2
17-02-2022,"Pune: Reduced activity in Covid pandemic triggers dementia in senior citizens, say psychiatrists",0
17-02-2022,"Board, mgmt overhauled in last 6 years, says NSE",1
17-02-2022,"West Bengal Covid positivity around 1%, lowest since pandemic began",0
17-02-2022,TN medicos in Ukraine in a fix amid threat of war with Russia,1
17-02-2022,"Board, mgmt overhauled in last 6 years, says NSE",0
17-02-2022,No Rs 1 lakh bonus for resident doctors for pandemic work,1
18-02-2022,"Having struggled for 100 days, villagers say won’t let politicians win credit war",1
19-02-2022,"Congress, BJP leaders in war of words over Maharana Pratap",1
19-02-2022,CBI questions NSE ex-MD; issues lookouts,0
19-02-2022,Doubling down: Pandemic forces rising trend of working two jobs,1
20-02-2022,CM Hemant Soren lauds Jharkhand Jaguar for ‘successful anti-Red operations’,1
21-02-2022,Andhra Pradesh: Three youngsters hurt in gang war,1
23-02-2022,Kolkata: Fitness expert fights off pandemic blow to open new outlet after 2 years,1
23-02-2022,"Sensex yo-yos over 1,000 points on war fears",0
23-02-2022,Happiness parade to beat pandemic blues,1
23-02-2022,Here comes a song to chase away the pandemic blues for students,1
24-02-2022,Surviving pandemic via aqua culture,1
24-02-2022,Kolkata students in Ukraine battle war fears and exam worries,1
24-02-2022,Sensex falls for 6th day in row amid Ukraine crisis,0
25-02-2022,Automobile inspector loses ₹1.2L in scam call,1
25-02-2022,"Sensex tanks 2,702 points, ends at six-month low",0
25-02-2022,"War declared, Kolkata students stuck in Ukraine on tenterhooks",1
25-02-2022,Chandigarh: PGI healthcare workers worked sans PPEs during Covid pandemic,1
25-02-2022,Swine flu cases in Madhya Pradesh dip 99% in 2 years of Covid pandemic,1
25-02-2022,"Two students return to Alwar from war zone, say Indian students in danger",1
25-02-2022,"Top 15 Gujarat companies shed Rs 92,000 crore as sensex dives",2
26-02-2022,"At 131, active Covid cases in Nashik least during pandemic",1
26-02-2022,Sensex rebounds over 1.3k pts as Russian oil supply not disrupted,2
26-02-2022,Sensex rebounds over 1.3k pts as Russian oil supply not disrupted,2
27-02-2022,Kids use palette and paintbrush to overcome pandemic blues,1
27-02-2022,"Back home, but worried for friends stranded in war zone",1
27-02-2022,"Kolkata: War in Ukraine 6,000km away, gold price soars in mid-wedding season",0
28-02-2022,Carving hope: Sculptors converge in Chandigarh for first time after pandemic,1
28-02-2022,"VSP, Tata Steel joint winners",2
28-02-2022,Bhopal boy who dodged war worries for cousin stranded in Ukraine,1
28-02-2022,Mumbai: Rs 2-lakh deal struck to kill NSE techie by wife’s boyfriend,1
28-02-2022,"Students in war zone, FS asks Russia, Ukraine envoys to ensure their safety",1
01-03-2022,"I have cherished memories of Ukraine, hope this war ends soon, says Ehan Bhat",1
01-03-2022,"Sensex gains 389 pts after plummeting over 1,000",2
01-03-2022,"Harrowing tale of Noida girl: Failed bid to reach Kyiv, stuck in a bus in war zone, then escape via Romania",1
