Date,news,output
01-09-2022,Eye donation movement yet to recover from pandemic blow,1
01-09-2022,"Pandemic curbs gone, Lucknow soaks in Ganesh Chaturthi festivities",1
02-09-2022,Sensex dives 770 points on foreign fund selloff,0
03-09-2022,US inflation spike spells trouble for Telangana students,1
03-09-2022,"IMF warns of protests, instability as Pakistan inflation touches 47-year high",1
05-09-2022,Pandemic triggered disorders in children’s behaviour: Experts,1
05-09-2022,Bangladesh PM thanks India for help during pandemic,1
05-09-2022,"Soft-spoken, easy-going, Cyrus Mistry was youngest to head Tata Group",1
05-09-2022,Tata Sons ex-chairman Cyrus Mistry killed in Ahmedabad-Mumbai highway accident,0
06-09-2022,"Former Tata Group chairman Cyrus Mistry injured head & chest, had haemorrhage: Autopsy",1
06-09-2022,"RIL, Delhivery, Tata Motors and other stocks in news today",1
06-09-2022,Green trucking to have double-digit share by 2030: Tata Motors,2
07-09-2022,"Cyrus Mistry cremated, 92-year-old Simone Tata attends in wheelchair",1
07-09-2022,"Global woes, inflation may not hit recovery: Moody’s",1
07-09-2022,Ahmedabad: Inflation expectations have fallen below 5% says report,0
08-09-2022,"Tata Power, InterGlobe Aviation and other stocks in news today",1
09-09-2022,"In a 1st, Tata Power planning for underground substations in city",1
09-09-2022,Inflation management can’t be left to monetary policy alone: FM,1
09-09-2022,Provide relief on war footing to Gadchiroli villages cut off by floods: HC to govt,1
11-09-2022,"Kolkata: Out of pandemic shadow, organizers loosen purse strings for bigger and better pujas",1
12-09-2022,Pandemic grounded: Fliers go up by 143% in 5 months,1
13-09-2022,West Bengal: 500 to oar in this year’s Sundarbans boat war,1
13-09-2022,"Kerala govt to vaccinate stray dogs on war footing, says minister M B Rajesh",1
13-09-2022,"Retail inflation up in August to 7%, IIP slows sharply",0
13-09-2022,"Sensex up for 3rd day, hits 60k pts again",2
14-09-2022,Inflation jump triggers fears of sharp rate hike this month,0
14-09-2022,Inflation jump triggers fears of sharp rate hike this month,0
14-09-2022,Armenia-Azerbaijan clash sparks fears of another war,1
14-09-2022,Inflation jump triggers fears of sharp rate hike this month,0
14-09-2022,"Amid drill with Japan, Indian ships also in Australia for war game",1
15-09-2022,End of Covid pandemic is 'in sight': WHO chief,1
15-09-2022,"Tata Steel, SBI and other stocks in news today",1
15-09-2022,WPI inflation dips in Aug to 11-month low of 12.4%,0
15-09-2022,"Sensex swings 1,232 points, weathers Wall Street rout",0
15-09-2022,West Bengal CM Mamata Banerjee to throw open Rs 600-crore Tata Metaliks expansion plant,1
15-09-2022,"War of words between ruling, oppn leaders over Foxconn moving to Guj",1
15-09-2022,"Sensex swings 1,232 pts, weathers Wall St rout",0
16-09-2022,"Tata Power, PVR, UPL and other stocks in news today",1
16-09-2022,"West Bengal now good place to invest in, we're very bullish: Tata bosses",1
16-09-2022,Sensex falls over 500 points in early trade amid weak global markets,0
17-09-2022,Hyderabad: Integration or liberation? TRS & BJP turf war begins,1
17-09-2022,"Sensex dives 1,093 pts on fears of sharp rate hikes",0
17-09-2022,"Sensex dives 1,093 pts on fears of sharp rate hikes",0
17-09-2022,Tata Power to expand solar plant at Tata Motors plant,1
17-09-2022,Jamshedpur: Fate of 12 lakh people living on Tata Steel leased land uncertain,1
18-09-2022,‘India’s vote doesn’t signal shift in Ukraine war stand’,1
19-09-2022,"US President Joe Biden says 'the pandemic is over' even as death toll, costs mount",1
21-09-2022,"Wipro, Tata Steel, Ambuja Cements and other stocks in news today",1
21-09-2022,Sensex rally loses steamahead of Fed’s rate call,0
21-09-2022,Sensex rallies 579 points ahead of Fed’s rate call,0
21-09-2022,Delhi cops act to avoid gang war after Rajasthan killing,1
21-09-2022,Sensex rally loses steam ahead of Fed’s rate call,0
23-09-2022,Sensex falls for 2nd day in row,0
23-09-2022,Tatas to pull plug on Tata Healthafter 7 years,1
23-09-2022,Tatas to pull plug on Tata Health after 7 years,1
24-09-2022,"Sensex dives 1,021 pts on foreign investor flight, weaker currency",0
24-09-2022,Tata Steel to merge 7 metal companies with itself,1
25-09-2022,"Col Dinesh Naikawade, Kargil war veteran, passes away in Pune",1
26-09-2022,Indore: Automobile showroom sealed,1
27-09-2022,"Vodafone Idea, Tata Motors and other stocks in news today",1
27-09-2022,Tata Motors to raise prices of CVs,0
27-09-2022,"Sensex tanks as foreign funds sell big, at 2-mth low",0
29-09-2022,Hind Motors EV JV structure to be ready by October,1
29-09-2022,"Rupee nears 82/$, sensex slides for sixth day in row",0
30-09-2022,Sensex sinks 750 pts from high as FPIs sell,0
01-10-2022,RBI lists Tata Sons with 15 NBFCs for more regulation,1
01-10-2022,"Sensex rallies 1k pts, breaks losing streak",2
01-10-2022,CDS signals integrated war machinery,1
01-10-2022,"Sensex rallies 1k pts, breaks losing streak",2
03-10-2022,Medicine Prize opens Nobel week clouded by war,1
04-10-2022,"In a first, RBI to tell government why inflation target is breached",1
04-10-2022,Sensex dips 638 pts to sub-57k level on weak global cues,0
04-10-2022,Heart attack cases up after pandemic in Indore,1
04-10-2022,Madras HC quashes FIR filed against public protest in pandemic,1
04-10-2022,"Sensex dips 638 pts to sub-57,000 level on weak global cues",0
04-10-2022,Sensex dips 638 pts lower at sub-57k on weak global cues,0
04-10-2022,Why India's inflation basket needs an overhaul,1
04-10-2022,Heart attack cases up post Covid pandemic,1
05-10-2022,Sensex zooms 1.3k pts on US mkts,2
05-10-2022,"Nasdaq jumps 3.3%, extending US stocks rally as Twitter surges",2
05-10-2022,Haryana sets up 'green war room' to fight bad air,1
05-10-2022,Sensex zooms 1.3 k points on US markets,2
05-10-2022,Gujarat's automobile market gets festive acceleration,2
05-10-2022,Sensex zooms 1.3k pts on US mkts,2
06-10-2022,Manager at automobile firm booked for embezzlement,1
06-10-2022,Deficient rain in gangetic plain is likely to increase food inflation in the near term,1
06-10-2022,"Tata Steel, HCL Tech, Zee Entertainment, JSW Energy and other stocks in news today",1
08-10-2022,"Tata Power mulls 10,000 MW clean energy capacity in next five years in Rajasthan",1
09-10-2022,"Maharashtra: Automobile sales pick up, dealers happy",1
09-10-2022,No HC relief to adoptive couple in war with biological parents,1
10-10-2022,Pandemic effect? Mental health issues surge by 254% in district,1
10-10-2022,"HUL, Tata Motors, and other stocks in news today",1
10-10-2022,Last war before Independence which shook British empire,1
11-10-2022,"Re hits record low of 82.72/$, sensex slides",0
11-10-2022,MK Stalin to Centre: Don't force another language war on us,1
11-10-2022,"Rupee hits record low of 82.72/$, sensex slides",0
11-10-2022,"Re hits record low of 82.72/$, sensex slides",0
12-10-2022,Sensex tanks 844 pts on rising global tensions,0
12-10-2022,"Chennai: Gang war on Alandur street, two-wheelers, autos trashed",1
12-10-2022,"After pandemic pause, don’t miss breast cancer screening now: Docs",1
13-10-2022,Tata offers 3cr equipment to health centres,1
13-10-2022,Sourav Ganguly's possible BCCI exit sparks TMC-BJP war of words,1
13-10-2022,"Retail inflation at 5-month high of 7.4%, IIP contracts 0.8%",0
13-10-2022,Lucknow: Tata AIG deprived of Rs 54 lakh by cyber fraudsters,1
13-10-2022,State BJP brass to set up war room in Choutuppal,1
13-10-2022,"CM Yogi Adityanath visits flood-hit UP districts, orders relief & rescue operations on a war footing",1
13-10-2022,"Delhi govt hikes minimum wages, Manish Sisodia says it will provide relief from inflation",1
15-10-2022,Wholesale inflation eases to 18-month low of 10.7% in September,2
15-10-2022,"Sensex soars 1,200 points intraday",2
15-10-2022,"Mumbai: Tata Power reports cyber attack on IT infrastructure; says all critical operations functioning, no impact on supply",1
15-10-2022,"Sensex soars 1,200 points intraday",2
15-10-2022,‘Plans on to make clubs absorb more Tata footballers’,1
15-10-2022,"Tata Power reports cyber attack on IT infra; says all critical ops functioning, no impact on supply",1
17-10-2022,Tata AIA to incentivise healthy lifestyle,1
17-10-2022,Pandemic to downturn alarm: 40% offices in ‘hi-tech’ Hyderabad still vacant,1
17-10-2022,Tata AIA to incentivise healthy life,1
18-10-2022,"Tata Communications, PVR, Adani Tranmission and other stocks in news today",1
18-10-2022,"Inflation war to be dogged, prolonged: RBI",1
18-10-2022,"Political road show, protests & war of words",1
18-10-2022,"Inflation war to be dogged, prolonged: RBI",1
19-10-2022,Automobile dealers unhappy with low customer footfall,0
19-10-2022,HDFC merger: NSE may tweak index rules,1
19-10-2022,"Adani Enterprises, HCL Tech, Tata Motors and other stocks in news today",1
19-10-2022,HDFC merger: NSE may tweak index rules,1
19-10-2022,IIT-Roorkee develops 'cancer detector' and transfers its technology to Tata Steel,1
20-10-2022,Sensex rises over 3% in 4-day rally,2
20-10-2022,All hands on deck: How Tata companies help revamp Air India,1
20-10-2022,From TCS to Taj: Several Tata Group companies helping revive Air India,1
20-10-2022,NSE may exclude HDFC from Nifty index before its merger with HDFC Bank,1
21-10-2022,Dilip rural poll war cry: ‘Be ready for ultimate sacrifice’,1
21-10-2022,"Use Covid pandemic to manage future outbreaks, says Union health minister Mansukh Mandaviya",1
22-10-2022,Sensex ends Samvat in red 1st time in 7 years,0
22-10-2022,Samvat 2078 worst for sensex in 7 years even as investor wealth grew,0
23-10-2022,Jharkhand: Automobile sales up by 20% this year,2
23-10-2022,"After pandemic lull, Dehradun markets abuzz with shoppers before Diwali",1
23-10-2022,Finance ministry: Fresh inflation fears in 2023 if geopolitical rows intensify,1
24-10-2022,Tata Steel & IIT-R ink deal for cancer detector,1
25-10-2022,Sensex makes biggest Muhurat gain in 14 years,2
25-10-2022,Sensex makes biggest Muhurat gain in 14 yrs,2
25-10-2022,Those who ventured into dairying in Dakshina Kannada district during pandemic quit it,1
25-10-2022,Myanmar military defends deadly air strike after accusations of war crime,1
25-10-2022,BSE launches electronic gold receipts,1
26-10-2022,"Sensex crosses 60,000 after 6 weeks, 4% away from all-time high",2
26-10-2022,"Court cites contradictions, gives bail to NSE 'scamster'",1
27-10-2022,"Dabur, Tata Chemicals, Hero Motocorp and other stocks in news today",1
28-10-2022,"Maruti, Dr Reddy's, Tata Power and other stocks in news today",1
28-10-2022,"After pandemic break, sports trials back in Delhi University from October 31",1
29-10-2022,General Motors Co temporarily halts paid advertising on Twitter,1
29-10-2022,"Mumbai: Sensex reclaims Rs 60,000, closes a tad lower on profit-taking",2
29-10-2022,"Sensex reclaims 60k, closes a tad lower on profit-taking",2
30-10-2022,Tata Trusts’ CEO to ‘retire’; Cyrus cousin named trustee,1
31-10-2022,"Maharashtra CM Eknath Shinde asks CAG to probe Rs 12,000 crore BMC contracts before, during pandemic",1
01-11-2022,Bengaluru: Veterans slam traffic police over Haifa war memorial,1
01-11-2022,Tata Steel’s Q2 profit dives 90%,2
01-11-2022,"Sensex at 10-month high, recovers 9,000 points in 4 months",2
01-11-2022,Tata Steel’s Q2 profit dives 90%,2
01-11-2022,"Sensex at 10-month high, recovers 9k points in 4 months",2
01-11-2022,"Back to business after pandemic pause? PG owners, eateries around Delhi University hope to recover",1
01-11-2022,Will meet VED as we plan new ventures: Tata boss to Nitin Gadkari,1
02-11-2022,Sensex crosses 61k after 10 mths,2
02-11-2022,Sensex crosses 61k after 10 months,2
02-11-2022,Seeman warns of language war in state,1
02-11-2022,Noel’s children come on board Tata Trust entity,1
02-11-2022,Tata Memorial Hospital trains cancer patient navigators for Indonesia,1
03-11-2022,Ukraine war pushes fertiliser subsidy bill to record Rs 2.2 lakh crore,1
03-11-2022,"After truce, fresh war of words between Bacchu Kadu and Ravi Rana",1
04-11-2022,Jamshedpur: Tata Steel dispatches 1st steel slag consignment to BRO,1
04-11-2022,Tata Hitachi makes Kgp plant its exports hub,2
04-11-2022,RBI likely to assure government it will rein in inflation in FY24,1
05-11-2022,Gujarat: Home textiles sector hurt by US-Europe inflation,1
05-11-2022,Why everyone in arms industry loves a good war,1
05-11-2022,Delhi: LG VK Saxena's letter to Punjab CM Bhagwant Mann sparks war of words,1
06-11-2022,West Bengal: 2 held for Rs 32 crore online fraud during pandemic,1
06-11-2022,Gujarat: Textiles units hurt by US-Europe inflation,1
10-11-2022,New leprosy cases see drop in Hyderabad as pandemic hits screening efforts,1
11-11-2022,The pandemic has made it harder for me to do my art: Anoushka Shankar,1
11-11-2022,Delhi: AAP’s war room to drive poll campaign,1
11-11-2022,Mutual fund SIP flows surge 50% in pandemic,1
11-11-2022,Sensex falls on US market weakness,0
12-11-2022,"Centre, state in war of words on dengue info",1
12-11-2022,"Sensex hits one year high, nears record peak of 62,000",2
13-11-2022,"Oct retail inflation will be below 7%, says RBI governor",2
13-11-2022,"Oct retail inflation to be below 7%, says RBI governor",2
13-11-2022,"October retail inflation to be below 7%, says RBI governor",2
14-11-2022,"In life after Covid, a mental health pandemic emerges",1
15-11-2022,Maharashtra govt school admissions better after pandemic,1
15-11-2022,"Retail inflation below 7% in Oct, WPI eases to 8.4%",2
15-11-2022,‘Love jihad is war strategy to attract women’,1
15-11-2022,Covid numbers in India drop to lowest since initial weeks of pandemic,2
16-11-2022,US stocks end higher amid signs of slowing inflation,2
17-11-2022,Sujit Naik’s century helps Tata gain lead,1
17-11-2022,"Sensex regains 62k, closes at all-time high of 61,981",2
17-11-2022,Class 8th student from Rohtak writes a book on her experience during pandemic,1
17-11-2022,"Sensex regains 62k, closes at all-time high of 61,981",2
18-11-2022,Telangana's rural inflation highest in country,1
18-11-2022,Goa: First full-fledged International Film Festival of India after pandemic set to be bigger,1
18-11-2022,Why TRS is at war with Election Commission over 'belan' and 'roti' rolling board,1
18-11-2022,Telangana: Goons on prowl make commute to Tata Institute of Social Science traumatic for girl students,1
18-11-2022,BBMP paid firm ₹5cr to set up Covid war room,1
18-11-2022,"Tata Hitachi eyes 6,500cr biz in 3yrs",2
18-11-2022,Bruhat Bengaluru Mahanagara Palike paid firm Rs 5 crore to set up Covid war room,1
19-11-2022,Tata Motors to replace DRL in sensex,2
19-11-2022,Another Chinese company under lens: Tax raids on MG Motors,1
23-11-2022,WHO hunts for the next big pandemic bug,1
23-11-2022,Victims' kin to commemorate sinking of SS Tilawa in World War II,1
25-11-2022,"Already listed on BSE, pharma major ZIM Laboratories to make NSE debut today",1
25-11-2022,Sensex hits lifetime high after Fed hints at slower rate hikes,2
25-11-2022,CM vows to encourage automobile industry in Belagavi,1
25-11-2022,I hope my first performance in Hyderabad post pandemic will be a memorable one: Bombay Jayashri,1
25-11-2022,Black Friday Sale: Inflation makes bargains elusive,1
26-11-2022,Maharashtra's active Covid count at lowest point since start of the pandemic,1
26-11-2022,"Some LAC problems due to '62 war loss, says Jaishankar",1
26-11-2022,"Kolkata: Fan war takes to the skies, boosts kite biz",1
26-11-2022,"US stocks: Nasdaq ends down as investors eye Black Friday sales, China infections",0
27-11-2022,Delhi: Capital City Minstrels back on stage with music of hope after pandemic,1
28-11-2022,Delhi MCD polls: Asaduddin Owaisi accuses CM Arvind Kejriwal of bias against Muslims during pandemic and NE riots,1
28-11-2022,Delhi MCD polls: Asaduddin Owaisi accuses CM Arvind Kejriwal of bias against Muslims during pandemic and NE riots,1
29-11-2022,Sensex closes at record high for third day in a row,2
29-11-2022,PM Modi: Vote bank made Congress tie up hands of forces in terror war,1
29-11-2022,PM Modi: Vote bank made Congress tie up hands of forces in terror war,1
29-11-2022,Sensex closes at record high for 3rd day in a row,2
30-11-2022,Sensex hits new high for 4th day in row,2
30-11-2022,Gujarat elections 2022: Kharge’s ‘Ravan’ barb at PM sparks war of words between BJP & Congress,1
01-12-2022,"Sensex hits 63k for first time, investor wealth nears Rs 300L cr",2
01-12-2022,"Rate-hike slowdown possible next month, inflation fight far from over: Fed chief Jerome Powell",1
01-12-2022,NSE IFSC-SGX Connect aims at full scale operations by June 2023,1
01-12-2022,"Gang war outside Central Jail, goon injured",1
01-12-2022,Uttarakhand: War of words between BJP & Congress over Gairsain,1
01-12-2022,"India lacks tactical, strategic know-how of war movies'",1
01-12-2022,"Sensex hits 63,000 for first time, investor wealth nears Rs 300 lakh crore",2
01-12-2022,Why sensex is in green even as other major global indices bleed,1
02-12-2022,Sensex closes at record high for 6th day in row,2
02-12-2022,Tata Play: 1st IPO from Tatas since TCS listing in ’04,2
02-12-2022,Tata Play: 1st IPO from Tatas since TCS listing in 2004,2
02-12-2022,"Sewage in Najafgarh drain, NGT seeks remedy 'on a war footing'",1
02-12-2022,Sensex closes at record high for 6th day in row,2
03-12-2022,"Sensex closes 416 points in red, ends 8-day rally",0
05-12-2022,RK Beach resembles war zone as Navy Day celebrated with grandeur in Visakhapatnam,1
06-12-2022,"Poor quality of 'dal' shook British empire, led to the last war before Independence'",1
06-12-2022,Jaguar with VIP numberplate kills woman parking scooter in Noida,1
06-12-2022,"Tata Motors, Vodafone India, HDFC and other stocks in news today",1
06-12-2022,Jaguar that killed woman may have been racing with another SUV: Cops,1
06-12-2022,Tata Motors may hike prices in January,2
07-12-2022,"RBI set to raise rates; outlook on growth, inflation in focus",1
07-12-2022,Murder charge added against Jaguar driver after order from Noida police commissioner Laxmi Singh,1
08-12-2022,‘Worst of inflation over’: RBI moderates rate hike to 35bps,1
08-12-2022,Tata Technologies invests in innovation centre in France,1
09-12-2022,Sensex snaps 4-day losing run,0
09-12-2022,Inflation likely softened to nine-month low in November: Report,2
09-12-2022,"In Mumbai, Tata Memorial, 3 hospitals tie up to cut kids' wait for transplant",1
10-12-2022,"On Noida's road where Jaguar killed a woman, no cops, no lights",1
11-12-2022,Sino-Japanese war doc remembered,1
11-12-2022,Tata doctors add old medicine to reduce breast cancer deaths,1
11-12-2022,Sudanese cadet who lost dad in war now officer,1
13-12-2022,Retail inflation moderates to 11-month low of 5.9% in November,2
13-12-2022,"Bharat Rashtra Samithi loses Telangana echo, BJP stung in hashtag war",1
13-12-2022,IPO play: Tatas to sell subsidiary Tata Tech shares,2
13-12-2022,IPO play: Tatas to sell Tata Tech shares,2
14-12-2022,Slowing US inflation raises hopes for Santa Claus rally,1
14-12-2022,Explainer: Demat accounts increase to 10.6 cr in November but monthly active NSE users dip to 3.6 cr,2
15-12-2022,Tata Comms to transfer IoT biz to arm,1
15-12-2022,"SBI, IRCTC, Tata Motors and other stocks in news",1
15-12-2022,Congress urges Amit Shah to seek governor report on midnight war room raid in Hyderabad,1
15-12-2022,Recurrent viral infections resurface among children in Hyderabad after pandemic lull,1
16-12-2022,Classroom to war room: IIT & IIM brains to steer poll strategy,1
16-12-2022,Sensex tanks 879 points on Fed’s hawkish stance on rate hikes,0
16-12-2022,76-year-old recounts refugee days in Kolkata during Bangladesh liberation war,1
16-12-2022,‘BRS engineered war room raid to steal poll blueprint’ in Telangana,1
17-12-2022,Patients suffer as Lone World War II era portable X-ray machine is now ‘scrap’,1
17-12-2022,"Sensex dives 2,200 points from peak of 63k on Dec 1",0
17-12-2022,Sealed and stamped in memory: Trophies from 1971 war,1
19-12-2022,"Yes Bank, Sun Pharma, Tata Motors and other stocks in news today",1
19-12-2022,"BJP, Nitish govt intensify war of words on Saran hooch tragedy payout",1
20-12-2022,"Battle of Longewala: 1971 war hero Bhairon Singh dies, PM Modi, Amit Shah pay rich tributes",1
21-12-2022,"China's Covid surge spooks D-St, sensex ends in red",0
21-12-2022,"Inflation stubborn, signs of upturn in capex: RBI",1
21-12-2022,"Inflation stubborn, signs of upturn in capex: RBI",1
22-12-2022,HC notice to school mgmt over pay cut in pandemic,1
22-12-2022,Sensex dives 635 points as Covid cases spike in China,0
22-12-2022,Sensex dives 635 points as Covid cases spike in China,0
22-12-2022,Govt tracking inflation to avoid surge in prices: FM,1
22-12-2022,Congress war room raid: Telangana HC stays cop notice against 3,1
23-12-2022,No coercive action in war room case: HC,1
23-12-2022,Tata Comm to buy live video co for $59mn,1
23-12-2022,"Cardinal denounces price rise, Ukraine war",1
23-12-2022,Putin says Russia wants end to war in Ukraine,1
24-12-2022,NSE MD roped in ex-CP's firm in 2009 for illegal snooping: CBI,1
24-12-2022,Sensex dives nearly 1k pts over fears of Covid spread,0
24-12-2022,"Despite progress, US Federal Reserve remains focused on inflation fight as 2023 rolls in",1
25-12-2022,Construction of 4 auditoriums delayed due to pandemic in Ahmedabad,1
25-12-2022,"Settled in US, VNITian donating for victims of Ukraine war",1
26-12-2022,"Tata Motors, Union Bank of India, HDFC and other stocks in news today",1
26-12-2022,"Rise in crime after government waged war on drugs, says Assam chief minister Himanta Biswa Sarma",1
27-12-2022,Manasi Tata now director on board of KSPL JV cos,1
27-12-2022,Manasi Tata on the board of KSPL’s JV cos,1
27-12-2022,Reducing core inflation key to easing prices’,1
27-12-2022,"Sensex up 721 points, recoups nearly half of last week's loss",2
27-12-2022,Manasi Tata is director on Kirloskar JVs,1
27-12-2022,Ukrainian who lost many kin in war hangs self in Kashi,1
27-12-2022,"Over call with Ukraine President Zelenskyy, PM Modi urges for end to war",1
27-12-2022,"Over call with Ukraine President Zelenskyy, PM Modi urges for end to war",1
28-12-2022,Sensex up for 2nd day in row on global cues,2
29-12-2022,"SBI, Tata Steel, KFin Technologies and other stocks in news today",1
29-12-2022,5 lakh-plus vehicles registered in Mumbai during pandemic years,2
30-12-2022,India's Eicher Motors to invest in Spanish EV firm Stark,1
30-12-2022,"To make Maharashtra $1 trillion economy, CM Eknath Shinde forms panel led by Tata Sons’ Chandrasekaran",1
30-12-2022,Guwahati: Household budgets shrink amid Covid and inflation,1
30-12-2022,"RIL, Cipla, Eicher Motors and other stocks in news today",1
01-01-2023,"After pandemic lull, Puneites ring in New Year with gusto",1
03-01-2023,Tata Steel did not approve Mango flyover design: Saryu,1
03-01-2023,"Sensex gains on GST, PMI data",2
04-01-2023,Drone advances in Ukraine war may bring dawn of killer robots,1
04-01-2023,Over 700 school-going children of labourers left Mumbai during Covid pandemic,1
05-01-2023,Sharad Pawar: Govt's wrong economic policies are causing inflation,1
05-01-2023,"Fed wants 'flexibility' on rates as inflation remains key focus, minutes show",1
05-01-2023,Sensex sees year’s first slide on profit-booking,2
05-01-2023,"AAP, BJP in war of words over nominated members in MCD",1
05-01-2023,"AAP, BJP in war of words over nominated members in MCD",1
06-01-2023,"Tata Motors, Ambuja Cements, Bajaj Finserv and other stocks in news today",1
06-01-2023,Future pandemic won’t wreak havoc like Covid: Scientists,1
07-01-2023,Sensex slips 940 pts in 1st week of 2023,0
07-01-2023,DRDO unit near city gets chemical war defence site status,1
07-01-2023,"BSE to guide small, medium units on raising funds via equity market",1
09-01-2023,187 Tata e-buses in four months in Bengaluru,2
10-01-2023,600 Ford workers press for better hiring terms at Tata,1
10-01-2023,Sensex up 847 points as global indices rally on US eco data,2
10-01-2023,Sensex up 847 points as global indices rally on US eco data,2
10-01-2023,Transformed Covid pandemic into opportunity: Women entrepreneurs,1
10-01-2023,"TCS, Tata Motors, RIL, JSW Steel and other stocks in news today",1
10-01-2023,600 Ford workers press for better hiring terms at Tata,1
11-01-2023,Sensex tanks on Fed rate hike jitters,0
13-01-2023,Assess Joshimath damage on war footing: CM Pushkar Singh Dhami to scientists,1
13-01-2023,Retail inflation eases to a 12-month low of 5.7% in December,2
13-01-2023,Sales of spirits surging in Maharashtra after 2 years of lull during pandemic,1
15-01-2023,Rates could stay high for long if Ukraine war continues: RBI governor Shaktikanta Das,1
15-01-2023,"If war simmers, interest rates may stay high: Das",1
16-01-2023,City schools focus on practicals before exams to fill pandemic gap,1
16-01-2023,Army Day celebrated with tributes to war heroes,1
16-01-2023,"1 suffers heart attack in Tata Mumbai Marathon, stable",1
16-01-2023,Winning hearts on crutches and wheelchairs in Tata Mumbai Marathon,1
16-01-2023,"TCS, Tata Motors, Wipro and other stocks in news today",1
17-01-2023,HC orders UP schools to give 15% rebate in fees paid during pandemic,1
17-01-2023,WPI inflation dips to 22-month low of 4.95%,2
17-01-2023,Rohingya crisis forgotten amid Ukraine war,1
18-01-2023,‘It is a relief’: Parents back pandemic fee rebate order,1
20-01-2023,RBI to get inflation within 4% by 2024,2
23-01-2023,Hyderabad logs zero Covid-19 cases for 1st time since pandemic began,1
24-01-2023,US confronts China with evidence of companies aiding Putin’s war in Ukraine,1
24-01-2023,SAT slashes NSE co-lo case fine to Rs 100 crore from Rs 625 crore,1
24-01-2023,SAT slashes NSE co-location case fine to Rs 100cr from Rs 625cr,1
