web-scraper-order,web-scraper-start-url,News
"1701353137-443","https://timesofindia.indiatimes.com/2023/10/2/archivelist/year-2023,month-10,starttime-45201.cms","Bee attack leaves student dead in Rajasthan's Sikar"
"1701353137-444","https://timesofindia.indiatimes.com/2023/10/2/archivelist/year-2023,month-10,starttime-45201.cms","TDP raises conspiracy angle in Fibernet scam"
"1701353137-445","https://timesofindia.indiatimes.com/2023/10/2/archivelist/year-2023,month-10,starttime-45201.cms","Indoreans pitch in as officials propel PM Modi’s special cleanliness drive"
"1701353137-446","https://timesofindia.indiatimes.com/2023/10/2/archivelist/year-2023,month-10,starttime-45201.cms","Walled City returns to normalcy"
"1701353137-447","https://timesofindia.indiatimes.com/2023/10/2/archivelist/year-2023,month-10,starttime-45201.cms","1 held for duping man of ₹30L on the pretext of opening hospital"
"1701353137-448","https://timesofindia.indiatimes.com/2023/10/2/archivelist/year-2023,month-10,starttime-45201.cms","Heroin, armsseized from Pak drone along Raj border"
"1701353137-449","https://timesofindia.indiatimes.com/2023/10/2/archivelist/year-2023,month-10,starttime-45201.cms","Palda godown gutted"
"1701353137-450","https://timesofindia.indiatimes.com/2023/10/2/archivelist/year-2023,month-10,starttime-45201.cms","Happiness index must rise along with income, says CM"
"1701353137-451","https://timesofindia.indiatimes.com/2023/10/2/archivelist/year-2023,month-10,starttime-45201.cms","CEC disapproves of ‘unfounded’ caste-related data"
"1701353137-452","https://timesofindia.indiatimes.com/2023/10/2/archivelist/year-2023,month-10,starttime-45201.cms","Bhatta Basti on edge after scuffle at tea shop, BJP leader blames police"
"1701353137-453","https://timesofindia.indiatimes.com/2023/10/2/archivelist/year-2023,month-10,starttime-45201.cms","MCC begins serving breakfast for civic workers; to cost ₹3cr"
"1701353137-454","https://timesofindia.indiatimes.com/2023/10/2/archivelist/year-2023,month-10,starttime-45201.cms","LED streetlights on outskrits of Jaipur shortly"
"1701353137-455","https://timesofindia.indiatimes.com/2023/10/2/archivelist/year-2023,month-10,starttime-45201.cms","Gehlot hindering state’s devpt: Goyal"
"1701353137-456","https://timesofindia.indiatimes.com/2023/10/2/archivelist/year-2023,month-10,starttime-45201.cms","Transgender woman killed in Kanota, body set on fire; 3 held"
"1701353137-457","https://timesofindia.indiatimes.com/2023/10/2/archivelist/year-2023,month-10,starttime-45201.cms","With 60 feats in 6 mths, robotic surgery facility goes strong"
"1701353137-458","https://timesofindia.indiatimes.com/2023/10/2/archivelist/year-2023,month-10,starttime-45201.cms","Property prices likely to go north from tomorrow in city"
"1701353137-459","https://timesofindia.indiatimes.com/2023/10/2/archivelist/year-2023,month-10,starttime-45201.cms","Three of a family drown in Sargur canal"
"1701353137-460","https://timesofindia.indiatimes.com/2023/10/2/archivelist/year-2023,month-10,starttime-45201.cms","Swachhta Prahari vans to monitor dumping of garbage in open in Jaipur"
"1701353137-461","https://timesofindia.indiatimes.com/2023/10/2/archivelist/year-2023,month-10,starttime-45201.cms","Surat PSI gets 2L sports scholarship"
"1701353137-462","https://timesofindia.indiatimes.com/2023/10/2/archivelist/year-2023,month-10,starttime-45201.cms","Cong calls for shutdown in Bastar tomorrow"
"1701353137-463","https://timesofindia.indiatimes.com/2023/10/2/archivelist/year-2023,month-10,starttime-45201.cms","Man climbs mobile tower seeking better amenities for village"
"1701353137-464","https://timesofindia.indiatimes.com/2023/10/2/archivelist/year-2023,month-10,starttime-45201.cms","Tests pose ordeals for patients at super-speciality block of SMS"
"1701353137-465","https://timesofindia.indiatimes.com/2023/10/2/archivelist/year-2023,month-10,starttime-45201.cms","Gujarat: 13-year-old girl alleges gang rape by Insta friends, 3 held"
"1701353137-466","https://timesofindia.indiatimes.com/2023/10/2/archivelist/year-2023,month-10,starttime-45201.cms","LFS, Stem players for Nationals"
"1701353137-467","https://timesofindia.indiatimes.com/2023/10/2/archivelist/year-2023,month-10,starttime-45201.cms","World medical education chief felicitated"
"1701353137-468","https://timesofindia.indiatimes.com/2023/10/2/archivelist/year-2023,month-10,starttime-45201.cms","Adrian Luna seals 1-0 win for Kerala Blasters FC against Jamshedpur FC"
"1701353137-469","https://timesofindia.indiatimes.com/2023/10/2/archivelist/year-2023,month-10,starttime-45201.cms","Rly staff clean rake in ‘14-min miracle’ in Vij"
"1701353137-470","https://timesofindia.indiatimes.com/2023/10/2/archivelist/year-2023,month-10,starttime-45201.cms","Smartphones to launch in India this month"
"1701353137-471","https://timesofindia.indiatimes.com/2023/10/2/archivelist/year-2023,month-10,starttime-45201.cms","Union’s gate meet protest today"
"1701353137-472","https://timesofindia.indiatimes.com/2023/10/2/archivelist/year-2023,month-10,starttime-45201.cms","Rly stn road to be named after freedom fighter"
"1701353137-473","https://timesofindia.indiatimes.com/2023/10/2/archivelist/year-2023,month-10,starttime-45201.cms","Govt suspends Naidu’s former secretary"
"1701353137-474","https://timesofindia.indiatimes.com/2023/10/2/archivelist/year-2023,month-10,starttime-45201.cms","Eatery staff accused of cheating"
"1701353137-475","https://timesofindia.indiatimes.com/2023/10/2/archivelist/year-2023,month-10,starttime-45201.cms","Greens raise concern over tree felling for NH works"
"1701353137-476","https://timesofindia.indiatimes.com/2023/10/2/archivelist/year-2023,month-10,starttime-45201.cms","Ajmer woman dies, two granddaughters hospitalised after consuming tea at home"
"1701353137-477","https://timesofindia.indiatimes.com/2023/10/2/archivelist/year-2023,month-10,starttime-45201.cms","DK forest department personnel win CM’s medal"
"1701353137-478","https://timesofindia.indiatimes.com/2023/10/2/archivelist/year-2023,month-10,starttime-45201.cms","Criminals open fire at police team, cop hurt"
"1701353137-479","https://timesofindia.indiatimes.com/2023/10/2/archivelist/year-2023,month-10,starttime-45201.cms","Former corporators, residents fume over poor Nashik roads"
"1701353137-480","https://timesofindia.indiatimes.com/2023/10/2/archivelist/year-2023,month-10,starttime-45201.cms","Teacher leads campaign on menstrual cups"
"1701353137-481","https://timesofindia.indiatimes.com/2023/10/2/archivelist/year-2023,month-10,starttime-45201.cms","Licences of seed sellers cancelled"
"1701353137-482","https://timesofindia.indiatimes.com/2023/10/2/archivelist/year-2023,month-10,starttime-45201.cms","NMC & other civic officials partake in cleanliness drives"
"1701353137-483","https://timesofindia.indiatimes.com/2023/10/2/archivelist/year-2023,month-10,starttime-45201.cms","Stock in Gangapur dam complex hits 100% mark, Nashik residents cheer"
"1701353137-484","https://timesofindia.indiatimes.com/2023/10/2/archivelist/year-2023,month-10,starttime-45201.cms","Pilot exhorts farmers to vote back Cong govt"
"1701353137-485","https://timesofindia.indiatimes.com/2023/10/2/archivelist/year-2023,month-10,starttime-45201.cms","Six persons end lives in separate incidents in Barmer and Balotra"
"1701353137-486","https://timesofindia.indiatimes.com/2023/10/2/archivelist/year-2023,month-10,starttime-45201.cms","Nashik ACB laid 127 traps to curb bribes worth ₹1cr"
"1701353137-487","https://timesofindia.indiatimes.com/2023/10/2/archivelist/year-2023,month-10,starttime-45201.cms","Jewellery worth ₹40L stolen from store in Ahmednagar"
"1701353137-488","https://timesofindia.indiatimes.com/2023/10/2/archivelist/year-2023,month-10,starttime-45201.cms","Fuel pump dealers end strike"
"1701353137-489","https://timesofindia.indiatimes.com/2023/10/2/archivelist/year-2023,month-10,starttime-45201.cms","Couple die of electrocution"
"1701353137-490","https://timesofindia.indiatimes.com/2023/10/2/archivelist/year-2023,month-10,starttime-45201.cms","Police seize gutka worth 43,000 from Chandwad"
"1701353137-491","https://timesofindia.indiatimes.com/2023/10/2/archivelist/year-2023,month-10,starttime-45201.cms","Getting cashless benefits involves several hassles"
"1701353137-492","https://timesofindia.indiatimes.com/2023/10/2/archivelist/year-2023,month-10,starttime-45201.cms","Eid Milad celebrated with devotion and gaiety in Belagavi"
"1701353137-493","https://timesofindia.indiatimes.com/2023/10/2/archivelist/year-2023,month-10,starttime-45201.cms","Prayagraj to get gazetteer after40 years"
"1701353137-494","https://timesofindia.indiatimes.com/2023/10/2/archivelist/year-2023,month-10,starttime-45201.cms","‘Staff have a role to take RSRTC ahead’"
"1701353137-495","https://timesofindia.indiatimes.com/2023/10/2/archivelist/year-2023,month-10,starttime-45201.cms","Yallamma Temple collects hundi donation worth ₹1 crore in 40 days"
"1701353137-496","https://timesofindia.indiatimes.com/2023/10/2/archivelist/year-2023,month-10,starttime-45201.cms","‘Shramdaan for Swachhata’ drive held in Hubballi"
"1701353137-497","https://timesofindia.indiatimes.com/2023/10/2/archivelist/year-2023,month-10,starttime-45201.cms","Embroidery worker duped of 1L by cybercrook with lure of full refund from e-comm giant"
"1701353137-498","https://timesofindia.indiatimes.com/2023/10/2/archivelist/year-2023,month-10,starttime-45201.cms","CISF official seriously injured after speeding car hits him at Mumbai airport"
"1701353137-499","https://timesofindia.indiatimes.com/2023/10/2/archivelist/year-2023,month-10,starttime-45201.cms","Biz deal not met, Pkl man booked for ₹8L fraud"
"1701353137-500","https://timesofindia.indiatimes.com/2023/10/2/archivelist/year-2023,month-10,starttime-45201.cms","Activist demands government support for all Devadasis"
