web-scraper-order,web-scraper-start-url,News
"1701353137-144","https://timesofindia.indiatimes.com/2023/10/2/archivelist/year-2023,month-10,starttime-45201.cms","Kim Kardashian and Tom Brody reunite at Jay Z’s VIP blackjack party"
"1701353137-145","https://timesofindia.indiatimes.com/2023/10/2/archivelist/year-2023,month-10,starttime-45201.cms","Happy Gandhi Jayanti 2023: Images, Quotes, Wishes, Messages, Cards, Greetings, Pictures and GIFs"
"1701353137-146","https://timesofindia.indiatimes.com/2023/10/2/archivelist/year-2023,month-10,starttime-45201.cms","West Bengal: 20-year-old dies of dengue, seventh victim in South Dum Dum this season"
"1701353137-147","https://timesofindia.indiatimes.com/2023/10/2/archivelist/year-2023,month-10,starttime-45201.cms","A sister's two-year battle for justice brings closure"
"1701353137-148","https://timesofindia.indiatimes.com/2023/10/2/archivelist/year-2023,month-10,starttime-45201.cms","Rural Bengal reports more cases of dengue than urban areas"
"1701353137-149","https://timesofindia.indiatimes.com/2023/10/2/archivelist/year-2023,month-10,starttime-45201.cms","North Korea blames US for 'terrorist act' at Cuban embassy"
"1701353137-150","https://timesofindia.indiatimes.com/2023/10/2/archivelist/year-2023,month-10,starttime-45201.cms","With 12 organ donations till September, West Bengal set to beat 2022 stats"
"1701353137-151","https://timesofindia.indiatimes.com/2023/10/2/archivelist/year-2023,month-10,starttime-45201.cms","Attackers set off bomb at Turkiye govt building"
"1701353137-152","https://timesofindia.indiatimes.com/2023/10/2/archivelist/year-2023,month-10,starttime-45201.cms","North Korea slams UN nuclear agency as US mouthpiece"
"1701353137-153","https://timesofindia.indiatimes.com/2023/10/2/archivelist/year-2023,month-10,starttime-45201.cms","Pre-puja rush at malls & shopping hubs on 1st Sunday of festive month"
"1701353137-154","https://timesofindia.indiatimes.com/2023/10/2/archivelist/year-2023,month-10,starttime-45201.cms","Investments by PE-VC halve YoY in Sept quarter"
"1701353137-155","https://timesofindia.indiatimes.com/2023/10/2/archivelist/year-2023,month-10,starttime-45201.cms","ATS member shot at by chain snatcher"
"1701353137-156","https://timesofindia.indiatimes.com/2023/10/2/archivelist/year-2023,month-10,starttime-45201.cms","Manjhi quits electoral politics on age ground"
"1701353137-157","https://timesofindia.indiatimes.com/2023/10/2/archivelist/year-2023,month-10,starttime-45201.cms","Woman bludgeoned to death at Greater Noida home while her family sleeps in other room"
"1701353137-158","https://timesofindia.indiatimes.com/2023/10/2/archivelist/year-2023,month-10,starttime-45201.cms","10 Cuban migrants killed in Mexico truck accident, 17 injured"
"1701353137-159","https://timesofindia.indiatimes.com/2023/10/2/archivelist/year-2023,month-10,starttime-45201.cms","Reliance Infra wins 405crore award against DVC"
"1701353137-160","https://timesofindia.indiatimes.com/2023/10/2/archivelist/year-2023,month-10,starttime-45201.cms","Man beaten to death for dialling 'wrong' number"
"1701353137-161","https://timesofindia.indiatimes.com/2023/10/2/archivelist/year-2023,month-10,starttime-45201.cms","'Ours is an everyday struggle, but we haven't lost sight of our target'"
"1701353137-162","https://timesofindia.indiatimes.com/2023/10/2/archivelist/year-2023,month-10,starttime-45201.cms","IMD predicts widespread rainfall across Bihar today"
"1701353137-163","https://timesofindia.indiatimes.com/2023/10/2/archivelist/year-2023,month-10,starttime-45201.cms","6,460 dengue cases logged in Bihar in September alone: Health dept"
"1701353137-164","https://timesofindia.indiatimes.com/2023/10/2/archivelist/year-2023,month-10,starttime-45201.cms","Cajugotto cut off as water erases its only road"
"1701353137-165","https://timesofindia.indiatimes.com/2023/10/2/archivelist/year-2023,month-10,starttime-45201.cms","Nightclub fire kills at least 13 in Spain's Murcia, search on for more victims"
"1701353137-166","https://timesofindia.indiatimes.com/2023/10/2/archivelist/year-2023,month-10,starttime-45201.cms","GPS tracker, ignition kill outsmart car thief in Gurgaon"
"1701353137-167","https://timesofindia.indiatimes.com/2023/10/2/archivelist/year-2023,month-10,starttime-45201.cms","Pro-China winner transfers jailed Maldives' ex-prez to house arrest"
"1701353137-168","https://timesofindia.indiatimes.com/2023/10/2/archivelist/year-2023,month-10,starttime-45201.cms","Pro-China winner transfers jailed Maldives' ex-prez to house arrest"
"1701353137-169","https://timesofindia.indiatimes.com/2023/10/2/archivelist/year-2023,month-10,starttime-45201.cms","RPSG co gets GST notice"
"1701353137-170","https://timesofindia.indiatimes.com/2023/10/2/archivelist/year-2023,month-10,starttime-45201.cms","Motherhood: Mahindra & Mahindra unveils flexibility policy"
"1701353137-171","https://timesofindia.indiatimes.com/2023/10/2/archivelist/year-2023,month-10,starttime-45201.cms","Mahadevaswamy is CMD of NBCC"
"1701353137-172","https://timesofindia.indiatimes.com/2023/10/2/archivelist/year-2023,month-10,starttime-45201.cms","Cipher case: Imran, Qureshi named 'principal accused'"
"1701353137-173","https://timesofindia.indiatimes.com/2023/10/2/archivelist/year-2023,month-10,starttime-45201.cms","Joe Biden presses GOP on aid for Ukraine"
"1701353137-174","https://timesofindia.indiatimes.com/2023/10/2/archivelist/year-2023,month-10,starttime-45201.cms","Blocked: 600 numbers of cheats ‘calling kin from abroad’ for help"
"1701353137-175","https://timesofindia.indiatimes.com/2023/10/2/archivelist/year-2023,month-10,starttime-45201.cms","PM gifts turmeric board, tribal varsity months before Telangana polls"
"1701353137-176","https://timesofindia.indiatimes.com/2023/10/2/archivelist/year-2023,month-10,starttime-45201.cms","In Slovakia elections, pro-Russia party wins vote but needs allies for coalition"
"1701353137-177","https://timesofindia.indiatimes.com/2023/10/2/archivelist/year-2023,month-10,starttime-45201.cms","Woman who fled Maui wildfire on foot dies in hospital"
"1701353137-178","https://timesofindia.indiatimes.com/2023/10/2/archivelist/year-2023,month-10,starttime-45201.cms","Car plunges into river mistaking it for road, 2 young doctors die"
"1701353137-179","https://timesofindia.indiatimes.com/2023/10/2/archivelist/year-2023,month-10,starttime-45201.cms","No plan to send military trainers to Ukraine: Rishi Sunak"
"1701353137-180","https://timesofindia.indiatimes.com/2023/10/2/archivelist/year-2023,month-10,starttime-45201.cms","At least 7 killed in Mexico church roof collapse"
"1701353137-181","https://timesofindia.indiatimes.com/2023/10/2/archivelist/year-2023,month-10,starttime-45201.cms","More downpour, 9-yr-old drowns, Kuttanad suffers"
"1701353137-182","https://timesofindia.indiatimes.com/2023/10/2/archivelist/year-2023,month-10,starttime-45201.cms","More downpour, 9-yr-old drowns, Kuttanad suffers"
"1701353137-183","https://timesofindia.indiatimes.com/2023/10/2/archivelist/year-2023,month-10,starttime-45201.cms","Met issues yellow alert in three Kerala districts"
"1701353137-184","https://timesofindia.indiatimes.com/2023/10/2/archivelist/year-2023,month-10,starttime-45201.cms","New vehicle series to be out in mid-Oct"
"1701353137-185","https://timesofindia.indiatimes.com/2023/10/2/archivelist/year-2023,month-10,starttime-45201.cms","Gandhi’s global stamp alive with Hyderabad curator"
"1701353137-186","https://timesofindia.indiatimes.com/2023/10/2/archivelist/year-2023,month-10,starttime-45201.cms","Motherhood: M&M unveils flexi policy"
"1701353137-187","https://timesofindia.indiatimes.com/2023/10/2/archivelist/year-2023,month-10,starttime-45201.cms","Playing Gandhi on stage has taught me a lot about life: Pratik Gandhi"
"1701353137-188","https://timesofindia.indiatimes.com/2023/10/2/archivelist/year-2023,month-10,starttime-45201.cms","Your daily horoscope: 2nd October, 2023"
"1701353137-189","https://timesofindia.indiatimes.com/2023/10/2/archivelist/year-2023,month-10,starttime-45201.cms","SPR still waits for revamp, traffic load to increase after Dwarka Expressway opens"
"1701353137-190","https://timesofindia.indiatimes.com/2023/10/2/archivelist/year-2023,month-10,starttime-45201.cms","CID fame Shivaji Satam reunites with old friends Daya and Anup Soni; says, “fun to reunite with them after a long time”"
"1701353137-191","https://timesofindia.indiatimes.com/2023/10/2/archivelist/year-2023,month-10,starttime-45201.cms","Telangana: Lure of quick buck led mechanic to kidnap boy for ransom in 2020"
"1701353137-192","https://timesofindia.indiatimes.com/2023/10/2/archivelist/year-2023,month-10,starttime-45201.cms","Healthway: India's first solar roof cycling track thrown open in Hyderabad"
"1701353137-193","https://timesofindia.indiatimes.com/2023/10/2/archivelist/year-2023,month-10,starttime-45201.cms","Man, out on bail after murdering wife and son, hangs self at home in Telangana"
"1701353137-194","https://timesofindia.indiatimes.com/2023/10/2/archivelist/year-2023,month-10,starttime-45201.cms","Wojciech Szczesny's heroics secure Juventus a gritty draw against Atalanta"
"1701353137-195","https://timesofindia.indiatimes.com/2023/10/2/archivelist/year-2023,month-10,starttime-45201.cms","Oldest seat of power in Gujarat to house India's biggest seat of Jainism studies"
"1701353137-196","https://timesofindia.indiatimes.com/2023/10/2/archivelist/year-2023,month-10,starttime-45201.cms","An ocean of possibilites"
"1701353137-197","https://timesofindia.indiatimes.com/2023/10/2/archivelist/year-2023,month-10,starttime-45201.cms","Ajit Pawar shows how a third fits in the tango"
"1701353137-198","https://timesofindia.indiatimes.com/2023/10/2/archivelist/year-2023,month-10,starttime-45201.cms","Pakistani actress Mahira Khan stuns in a pastel lehenga as she marries businessman beau Salim Karim – watch inside video"
"1701353137-199","https://timesofindia.indiatimes.com/2023/10/2/archivelist/year-2023,month-10,starttime-45201.cms","Gujarat: September GST collection rises 12% to Rs 10,129 crore"
"1701353137-200","https://timesofindia.indiatimes.com/2023/10/2/archivelist/year-2023,month-10,starttime-45201.cms","Gujarat: September GST collection rises 12% to Rs 10,129 crore"
"1701353137-201","https://timesofindia.indiatimes.com/2023/10/2/archivelist/year-2023,month-10,starttime-45201.cms","Gujarat: September GST collection rises 12% to Rs 10,129 crore"
"1701353137-202","https://timesofindia.indiatimes.com/2023/10/2/archivelist/year-2023,month-10,starttime-45201.cms","Gujarat: September GST collection rises 12% to Rs 10,129 crore"
"1701353137-203","https://timesofindia.indiatimes.com/2023/10/2/archivelist/year-2023,month-10,starttime-45201.cms","Not just a meaty affair: Carrot, broccoli in Kolkata Police dog squad diet"
"1701353137-204","https://timesofindia.indiatimes.com/2023/10/2/archivelist/year-2023,month-10,starttime-45201.cms","Woman beaten by father-in-law for keeping phone"
"1701353137-205","https://timesofindia.indiatimes.com/2023/10/2/archivelist/year-2023,month-10,starttime-45201.cms","Cop, towing staffer attack 17-year-old in Navrangpura"
"1701353137-206","https://timesofindia.indiatimes.com/2023/10/2/archivelist/year-2023,month-10,starttime-45201.cms","Gujarat's GIFT City to rival global financial hubs"
"1701353137-207","https://timesofindia.indiatimes.com/2023/10/2/archivelist/year-2023,month-10,starttime-45201.cms","Google is killing this Gmail's over 10-year-old feature"
"1701353137-208","https://timesofindia.indiatimes.com/2023/10/2/archivelist/year-2023,month-10,starttime-45201.cms","Lalbaugcha Raja receives cash donations over Rs 5 crore"
"1701353137-209","https://timesofindia.indiatimes.com/2023/10/2/archivelist/year-2023,month-10,starttime-45201.cms","Video of students playing card game in Palghar school goes viral"
"1701353137-210","https://timesofindia.indiatimes.com/2023/10/2/archivelist/year-2023,month-10,starttime-45201.cms","‘Swachhata Hi Seva’: Mission to drive out filth begins across Delhi"
"1701353137-211","https://timesofindia.indiatimes.com/2023/10/2/archivelist/year-2023,month-10,starttime-45201.cms","Newbie mom Swara Bhasker sings a ‘sohar’ during daughter Raabiyaa’s Chhathhi ceremony – watch video"
"1701353137-212","https://timesofindia.indiatimes.com/2023/10/2/archivelist/year-2023,month-10,starttime-45201.cms","Asian Games: Indian men's and women's teams bag bronze medals in roller skating"
"1701353137-213","https://timesofindia.indiatimes.com/2023/10/2/archivelist/year-2023,month-10,starttime-45201.cms","Mumbai: Why is supply of flats for low and middle income groups so poor?"
"1701353137-214","https://timesofindia.indiatimes.com/2023/10/2/archivelist/year-2023,month-10,starttime-45201.cms","Repeated calls from a number led police to constable's killer"
"1701353137-215","https://timesofindia.indiatimes.com/2023/10/2/archivelist/year-2023,month-10,starttime-45201.cms","Mhada slowed in 80's as neta-builder nexus grew"
"1701353137-216","https://timesofindia.indiatimes.com/2023/10/2/archivelist/year-2023,month-10,starttime-45201.cms","A promising career, civil services dream cruelly cut short"
"1701353137-217","https://timesofindia.indiatimes.com/2023/10/2/archivelist/year-2023,month-10,starttime-45201.cms","​Skin care: 7 healthy habits for your skin"
"1701353137-218","https://timesofindia.indiatimes.com/2023/10/2/archivelist/year-2023,month-10,starttime-45201.cms","Bengal’s leading OTT platform announces season 7, promises to go beyond conventional"
"1701353137-219","https://timesofindia.indiatimes.com/2023/10/2/archivelist/year-2023,month-10,starttime-45201.cms","Bengal’s leading OTT platform announces season 7, promises to go beyond conventional"
"1701353137-220","https://timesofindia.indiatimes.com/2023/10/2/archivelist/year-2023,month-10,starttime-45201.cms","Rail roko stir at Diva station affects traffic on all 8 lines"
"1701353137-221","https://timesofindia.indiatimes.com/2023/10/2/archivelist/year-2023,month-10,starttime-45201.cms","Regularise services of 23 TB health visitors: HC"
"1701353137-222","https://timesofindia.indiatimes.com/2023/10/2/archivelist/year-2023,month-10,starttime-45201.cms","Karnataka: JD(S) brass gets cadres to pledge they won’t leave"
"1701353137-223","https://timesofindia.indiatimes.com/2023/10/2/archivelist/year-2023,month-10,starttime-45201.cms","SPR still waits for revamp, traffic load to increase after Dwarka e-way opens"
"1701353137-224","https://timesofindia.indiatimes.com/2023/10/2/archivelist/year-2023,month-10,starttime-45201.cms","Affordable housing projects held up, cos on DTCP radar"
"1701353137-225","https://timesofindia.indiatimes.com/2023/10/2/archivelist/year-2023,month-10,starttime-45201.cms","Students help BMC, take part in beach clean-up drive"
"1701353137-226","https://timesofindia.indiatimes.com/2023/10/2/archivelist/year-2023,month-10,starttime-45201.cms","40 teachers, students from Hry to hone their skills in UK college; selection on"
"1701353137-227","https://timesofindia.indiatimes.com/2023/10/2/archivelist/year-2023,month-10,starttime-45201.cms","40 teachers, students from Hry to hone their skills in UK college; selection on"
"1701353137-228","https://timesofindia.indiatimes.com/2023/10/2/archivelist/year-2023,month-10,starttime-45201.cms","RWAs allege political interference in registrar office work, protest"
"1701353137-229","https://timesofindia.indiatimes.com/2023/10/2/archivelist/year-2023,month-10,starttime-45201.cms","Wk-long traffic awareness drive kicks off"
"1701353137-230","https://timesofindia.indiatimes.com/2023/10/2/archivelist/year-2023,month-10,starttime-45201.cms","Youth falls off bike after ramming into morning walker, dies at hosp"
"1701353137-231","https://timesofindia.indiatimes.com/2023/10/2/archivelist/year-2023,month-10,starttime-45201.cms","Kenyan (51) with POEMS syndrome treated at city hosp"
"1701353137-232","https://timesofindia.indiatimes.com/2023/10/2/archivelist/year-2023,month-10,starttime-45201.cms","Take action over complaints of pollution in Vasundhara, UP pollution board told"
"1701353137-233","https://timesofindia.indiatimes.com/2023/10/2/archivelist/year-2023,month-10,starttime-45201.cms","Noida: Film City phase 1 on 230 acres now, companies invited for third time"
"1701353137-234","https://timesofindia.indiatimes.com/2023/10/2/archivelist/year-2023,month-10,starttime-45201.cms","Bigg Boss Telugu 7 Update: Rathika becomes the fourth contestant to get eliminated from the show"
"1701353137-235","https://timesofindia.indiatimes.com/2023/10/2/archivelist/year-2023,month-10,starttime-45201.cms","Cop & homeguard among three booked for thrashing couple, sexually harassing woman"
"1701353137-236","https://timesofindia.indiatimes.com/2023/10/2/archivelist/year-2023,month-10,starttime-45201.cms","Take paracetamol, not painkillers, docs tell dengue patients"
"1701353137-237","https://timesofindia.indiatimes.com/2023/10/2/archivelist/year-2023,month-10,starttime-45201.cms","RWAs complain of low water pressure and empty tanks"
"1701353137-238","https://timesofindia.indiatimes.com/2023/10/2/archivelist/year-2023,month-10,starttime-45201.cms","Project stuck since ’17, Rera allows promoter to complete flats in 12 mths under its watch"
"1701353137-239","https://timesofindia.indiatimes.com/2023/10/2/archivelist/year-2023,month-10,starttime-45201.cms","Husband among 4 held for woman’s murder"
"1701353137-240","https://timesofindia.indiatimes.com/2023/10/2/archivelist/year-2023,month-10,starttime-45201.cms","Rail roko stir at Diva station affects traffic on all 8 lines"
"1701353137-241","https://timesofindia.indiatimes.com/2023/10/2/archivelist/year-2023,month-10,starttime-45201.cms","HC seeks reply from govt on abuse at kids’ shelter"
"1701353137-242","https://timesofindia.indiatimes.com/2023/10/2/archivelist/year-2023,month-10,starttime-45201.cms","Allow work to start on 6 projects of Wish Town, panel to tell NCLAT"
"1701353137-243","https://timesofindia.indiatimes.com/2023/10/2/archivelist/year-2023,month-10,starttime-45201.cms","Marico CEO Gupta named ASCI chairman"
"1701353137-244","https://timesofindia.indiatimes.com/2023/10/2/archivelist/year-2023,month-10,starttime-45201.cms","Rel Infra wins 405cr award against DVC"
"1701353137-245","https://timesofindia.indiatimes.com/2023/10/2/archivelist/year-2023,month-10,starttime-45201.cms","HC sets aside 1993 detention order executed after 30 yrs"
"1701353137-246","https://timesofindia.indiatimes.com/2023/10/2/archivelist/year-2023,month-10,starttime-45201.cms","Nos. netted at Dadar twice daily average on WR stretch"
"1701353137-247","https://timesofindia.indiatimes.com/2023/10/2/archivelist/year-2023,month-10,starttime-45201.cms","Swachhata Hi Seva: BMC holds mass cleanliness drive in city"
"1701353137-248","https://timesofindia.indiatimes.com/2023/10/2/archivelist/year-2023,month-10,starttime-45201.cms","Motherhood: M&M unveils flexi policy"
"1701353137-249","https://timesofindia.indiatimes.com/2023/10/2/archivelist/year-2023,month-10,starttime-45201.cms","Man held for murder of watchman"
"1701353137-250","https://timesofindia.indiatimes.com/2023/10/2/archivelist/year-2023,month-10,starttime-45201.cms","CM pulls up BMC officials over unclean public loos"
"1701353137-251","https://timesofindia.indiatimes.com/2023/10/2/archivelist/year-2023,month-10,starttime-45201.cms","Cancel holiday on taxpayers’ money, says Aaditya to min"
"1701353137-252","https://timesofindia.indiatimes.com/2023/10/2/archivelist/year-2023,month-10,starttime-45201.cms","64-yr-old reports fake email ID"
"1701353137-253","https://timesofindia.indiatimes.com/2023/10/2/archivelist/year-2023,month-10,starttime-45201.cms","Students help BMC, take part in beach clean-up drive"
"1701353137-254","https://timesofindia.indiatimes.com/2023/10/2/archivelist/year-2023,month-10,starttime-45201.cms","Cancel holiday on taxpayers' money, says Aaditya to min"
"1701353137-255","https://timesofindia.indiatimes.com/2023/10/2/archivelist/year-2023,month-10,starttime-45201.cms","Alternative reservoir won’t be at Shantivan Garden: Lodha"
"1701353137-256","https://timesofindia.indiatimes.com/2023/10/2/archivelist/year-2023,month-10,starttime-45201.cms","‘Won’t come under any kind of pressure on MLAs’ disqualification’"
"1701353137-257","https://timesofindia.indiatimes.com/2023/10/2/archivelist/year-2023,month-10,starttime-45201.cms","Woman from Kenya held at airport with 1.6cr gold"
"1701353137-258","https://timesofindia.indiatimes.com/2023/10/2/archivelist/year-2023,month-10,starttime-45201.cms","Learning on the go: Science expo at Metro stns"
"1701353137-259","https://timesofindia.indiatimes.com/2023/10/2/archivelist/year-2023,month-10,starttime-45201.cms","Fire breaks out at industrial estate"
"1701353137-260","https://timesofindia.indiatimes.com/2023/10/2/archivelist/year-2023,month-10,starttime-45201.cms","Isro is keeping a close eye on Aditya’s journey"
"1701353137-261","https://timesofindia.indiatimes.com/2023/10/2/archivelist/year-2023,month-10,starttime-45201.cms","Youth held for posts against Kannadigas"
"1701353137-262","https://timesofindia.indiatimes.com/2023/10/2/archivelist/year-2023,month-10,starttime-45201.cms","14 min clean-up of Vande Bharat"
"1701353137-263","https://timesofindia.indiatimes.com/2023/10/2/archivelist/year-2023,month-10,starttime-45201.cms","When Mahatma Gandhi christened a Channapatna boy via postcard"
"1701353137-264","https://timesofindia.indiatimes.com/2023/10/2/archivelist/year-2023,month-10,starttime-45201.cms","Man stabs auto driver, arrested"
"1701353137-265","https://timesofindia.indiatimes.com/2023/10/2/archivelist/year-2023,month-10,starttime-45201.cms","Apartments in Bengaluru flush with treated water as local demand drops"
"1701353137-266","https://timesofindia.indiatimes.com/2023/10/2/archivelist/year-2023,month-10,starttime-45201.cms","English adaptation of Parva to make grand stage entry"
"1701353137-267","https://timesofindia.indiatimes.com/2023/10/2/archivelist/year-2023,month-10,starttime-45201.cms","In death, cabbie from Karnataka's Somasagara village saves five lives"
"1701353137-268","https://timesofindia.indiatimes.com/2023/10/2/archivelist/year-2023,month-10,starttime-45201.cms","Cops, companies’ assn agree on ways to decongest ORR"
"1701353137-269","https://timesofindia.indiatimes.com/2023/10/2/archivelist/year-2023,month-10,starttime-45201.cms","BCYA ‘A’ emerge champs"
"1701353137-270","https://timesofindia.indiatimes.com/2023/10/2/archivelist/year-2023,month-10,starttime-45201.cms","BBMP ward delimitation maps posted on website"
"1701353137-271","https://timesofindia.indiatimes.com/2023/10/2/archivelist/year-2023,month-10,starttime-45201.cms","New terminal at Chennai airport still has miles to go"
"1701353137-272","https://timesofindia.indiatimes.com/2023/10/2/archivelist/year-2023,month-10,starttime-45201.cms","New power tariff norms for seasonal MSMEs kick in"
"1701353137-273","https://timesofindia.indiatimes.com/2023/10/2/archivelist/year-2023,month-10,starttime-45201.cms","Murali picks India as favourites to win WC"
"1701353137-274","https://timesofindia.indiatimes.com/2023/10/2/archivelist/year-2023,month-10,starttime-45201.cms","PE-VC Investments halve YoY in Sept qtr"
"1701353137-275","https://timesofindia.indiatimes.com/2023/10/2/archivelist/year-2023,month-10,starttime-45201.cms","Ashok Nagar: Sewage in water pipes"
"1701353137-276","https://timesofindia.indiatimes.com/2023/10/2/archivelist/year-2023,month-10,starttime-45201.cms","NCB warns people of imposter scam"
"1701353137-277","https://timesofindia.indiatimes.com/2023/10/2/archivelist/year-2023,month-10,starttime-45201.cms","Annamalai blames TN govt for death of children"
"1701353137-278","https://timesofindia.indiatimes.com/2023/10/2/archivelist/year-2023,month-10,starttime-45201.cms","Chennai worst hit by noise pollution among metros"
"1701353137-279","https://timesofindia.indiatimes.com/2023/10/2/archivelist/year-2023,month-10,starttime-45201.cms","45 camps held; ₹14L collected for letting mosquitoes breed"
"1701353137-280","https://timesofindia.indiatimes.com/2023/10/2/archivelist/year-2023,month-10,starttime-45201.cms","Cauvery issue: EPS demands all-party meet"
"1701353137-281","https://timesofindia.indiatimes.com/2023/10/2/archivelist/year-2023,month-10,starttime-45201.cms","IPS officer quits, may join Cong"
"1701353137-282","https://timesofindia.indiatimes.com/2023/10/2/archivelist/year-2023,month-10,starttime-45201.cms","Woman from Kenya held at Mumbai airport with Rs 1.6 crore gold"
"1701353137-283","https://timesofindia.indiatimes.com/2023/10/2/archivelist/year-2023,month-10,starttime-45201.cms","Congress against wrong practices in name of religion, says K S Alagiri"
"1701353137-284","https://timesofindia.indiatimes.com/2023/10/2/archivelist/year-2023,month-10,starttime-45201.cms","Minister launches scheme to plant 1 crore palm seeds in coastal areas"
"1701353137-285","https://timesofindia.indiatimes.com/2023/10/2/archivelist/year-2023,month-10,starttime-45201.cms","Sea The Sun for Hyd main event"
"1701353137-286","https://timesofindia.indiatimes.com/2023/10/2/archivelist/year-2023,month-10,starttime-45201.cms","Police medal for 5 for curbing sale of arrack"
"1701353137-287","https://timesofindia.indiatimes.com/2023/10/2/archivelist/year-2023,month-10,starttime-45201.cms","Power cuts in parts of Chennai on Wednesday"
"1701353137-288","https://timesofindia.indiatimes.com/2023/10/2/archivelist/year-2023,month-10,starttime-45201.cms","Alagiri slams move to cut MBBS seats"
"1701353137-289","https://timesofindia.indiatimes.com/2023/10/2/archivelist/year-2023,month-10,starttime-45201.cms","Tambaram councillors rue lack of autonomy, want substantive meet"
"1701353137-290","https://timesofindia.indiatimes.com/2023/10/2/archivelist/year-2023,month-10,starttime-45201.cms","Double delight for Arunagiri"
