web-scraper-order,web-scraper-start-url,News
"1701353137-291","https://timesofindia.indiatimes.com/2023/10/2/archivelist/year-2023,month-10,starttime-45201.cms","NDPS sleuths register 6,824 cases till August"
"1701353137-292","https://timesofindia.indiatimes.com/2023/10/2/archivelist/year-2023,month-10,starttime-45201.cms","Install circuit breakers to prevent electrical mishaps, says Tangedco"
"1701353137-293","https://timesofindia.indiatimes.com/2023/10/2/archivelist/year-2023,month-10,starttime-45201.cms","Many suburban train services cancelled due to engg work"
"1701353137-294","https://timesofindia.indiatimes.com/2023/10/2/archivelist/year-2023,month-10,starttime-45201.cms","Grievance meeting for electricity consumers"
"1701353137-295","https://timesofindia.indiatimes.com/2023/10/2/archivelist/year-2023,month-10,starttime-45201.cms","Panel seeks views on ending caste clashes"
"1701353137-296","https://timesofindia.indiatimes.com/2023/10/2/archivelist/year-2023,month-10,starttime-45201.cms","Medak dist chief quits Congress"
"1701353137-297","https://timesofindia.indiatimes.com/2023/10/2/archivelist/year-2023,month-10,starttime-45201.cms","Hunt on for 2 women for robbing driver"
"1701353137-298","https://timesofindia.indiatimes.com/2023/10/2/archivelist/year-2023,month-10,starttime-45201.cms","BRS ministers slam PM over BJP promises"
"1701353137-299","https://timesofindia.indiatimes.com/2023/10/2/archivelist/year-2023,month-10,starttime-45201.cms","Governor shows the way, joins beach cleanup programme"
"1701353137-300","https://timesofindia.indiatimes.com/2023/10/2/archivelist/year-2023,month-10,starttime-45201.cms","Jobless youth have power to oust BRS govt, says Revanth"
"1701353137-301","https://timesofindia.indiatimes.com/2023/10/2/archivelist/year-2023,month-10,starttime-45201.cms","‘Why isn’t TSPSC board disbanded’"
"1701353137-302","https://timesofindia.indiatimes.com/2023/10/2/archivelist/year-2023,month-10,starttime-45201.cms","Power cuts, poor response irk residents of Padappai"
"1701353137-303","https://timesofindia.indiatimes.com/2023/10/2/archivelist/year-2023,month-10,starttime-45201.cms","Hyderabad gears up for 18th edition of Qadir Ali Baig theatre fest"
"1701353137-304","https://timesofindia.indiatimes.com/2023/10/2/archivelist/year-2023,month-10,starttime-45201.cms","Congress lost trust of people, BJP has no love for Telangana, says KTR"
"1701353137-305","https://timesofindia.indiatimes.com/2023/10/2/archivelist/year-2023,month-10,starttime-45201.cms","Telangana: Another jolt to BRS as MLC Kasireddy quits to join Congress"
"1701353137-306","https://timesofindia.indiatimes.com/2023/10/2/archivelist/year-2023,month-10,starttime-45201.cms","Ahead of ECI team visit, police asked to finish investigations"
"1701353137-307","https://timesofindia.indiatimes.com/2023/10/2/archivelist/year-2023,month-10,starttime-45201.cms","Kishan: KCR has no time for launches"
"1701353137-308","https://timesofindia.indiatimes.com/2023/10/2/archivelist/year-2023,month-10,starttime-45201.cms","New study reveals Slender Lorises as distinct species"
"1701353137-309","https://timesofindia.indiatimes.com/2023/10/2/archivelist/year-2023,month-10,starttime-45201.cms","‘Anganwadi workers in pay revision panel’"
"1701353137-310","https://timesofindia.indiatimes.com/2023/10/2/archivelist/year-2023,month-10,starttime-45201.cms","Telangana: Owaisi asks Muslims to vote for BRS where MIM not in poll fray"
"1701353137-311","https://timesofindia.indiatimes.com/2023/10/2/archivelist/year-2023,month-10,starttime-45201.cms","Road crash claims life of 23-year-old"
"1701353137-312","https://timesofindia.indiatimes.com/2023/10/2/archivelist/year-2023,month-10,starttime-45201.cms","Hyderabad: Charminar zone losing out on tax money, records collection less than 50% of target"
"1701353137-313","https://timesofindia.indiatimes.com/2023/10/2/archivelist/year-2023,month-10,starttime-45201.cms","2 held for stealing autorickshaws, 11 vehicles recovered"
"1701353137-314","https://timesofindia.indiatimes.com/2023/10/2/archivelist/year-2023,month-10,starttime-45201.cms","Vijayashanti, Rajgopal give Praja Garjana Sabha a miss"
"1701353137-315","https://timesofindia.indiatimes.com/2023/10/2/archivelist/year-2023,month-10,starttime-45201.cms","Swachhata drive held at Nehru Zoo"
"1701353137-316","https://timesofindia.indiatimes.com/2023/10/2/archivelist/year-2023,month-10,starttime-45201.cms","KTR releases docu video on T martyrs"
"1701353137-317","https://timesofindia.indiatimes.com/2023/10/2/archivelist/year-2023,month-10,starttime-45201.cms","Many Telangana colleges submitting fake documents for accreditation: Faculty"
"1701353137-318","https://timesofindia.indiatimes.com/2023/10/2/archivelist/year-2023,month-10,starttime-45201.cms","Gretsy wins feature event"
"1701353137-319","https://timesofindia.indiatimes.com/2023/10/2/archivelist/year-2023,month-10,starttime-45201.cms","All-round show by Yashveer, Faiz"
"1701353137-320","https://timesofindia.indiatimes.com/2023/10/2/archivelist/year-2023,month-10,starttime-45201.cms","Top institutes offer self-paced cert courses"
"1701353137-321","https://timesofindia.indiatimes.com/2023/10/2/archivelist/year-2023,month-10,starttime-45201.cms","Row over twoguv picks for VC search panel nominee"
"1701353137-322","https://timesofindia.indiatimes.com/2023/10/2/archivelist/year-2023,month-10,starttime-45201.cms","Man hangs self after tiff with spouse"
"1701353137-323","https://timesofindia.indiatimes.com/2023/10/2/archivelist/year-2023,month-10,starttime-45201.cms","‘Not in town’ for TMC, Giriraj to meet Bengal BJP MPs"
"1701353137-324","https://timesofindia.indiatimes.com/2023/10/2/archivelist/year-2023,month-10,starttime-45201.cms","13,000 km, 41k patients: Hosp on wheels completes a year"
"1701353137-325","https://timesofindia.indiatimes.com/2023/10/2/archivelist/year-2023,month-10,starttime-45201.cms","Sea The Sun fancied for Deccan Derby"
"1701353137-326","https://timesofindia.indiatimes.com/2023/10/2/archivelist/year-2023,month-10,starttime-45201.cms","‘Inconsistent’ Fakhar an impact player: Shadab"
"1701353137-327","https://timesofindia.indiatimes.com/2023/10/2/archivelist/year-2023,month-10,starttime-45201.cms","Kolkata: Repair focus on oldest subway along Eastern Metropolitan Bypass"
"1701353137-328","https://timesofindia.indiatimes.com/2023/10/2/archivelist/year-2023,month-10,starttime-45201.cms","Meet on legal aid for disaster victims"
"1701353137-329","https://timesofindia.indiatimes.com/2023/10/2/archivelist/year-2023,month-10,starttime-45201.cms","Pitching event for woman entrepreneurs"
"1701353137-330","https://timesofindia.indiatimes.com/2023/10/2/archivelist/year-2023,month-10,starttime-45201.cms","Heritage panel approves Kalighat temple complex restoration project"
"1701353137-331","https://timesofindia.indiatimes.com/2023/10/2/archivelist/year-2023,month-10,starttime-45201.cms","De-stress lounge at ATC to help air traffic controllers relax, ensure safety in the sky"
"1701353137-332","https://timesofindia.indiatimes.com/2023/10/2/archivelist/year-2023,month-10,starttime-45201.cms","42% of Kolkata’s rainfall this monsoon only in September"
"1701353137-333","https://timesofindia.indiatimes.com/2023/10/2/archivelist/year-2023,month-10,starttime-45201.cms","Cops, college focus on young drivers & speed"
"1701353137-334","https://timesofindia.indiatimes.com/2023/10/2/archivelist/year-2023,month-10,starttime-45201.cms","Don’t worry about exams, health comes first: Schools to parents"
"1701353137-335","https://timesofindia.indiatimes.com/2023/10/2/archivelist/year-2023,month-10,starttime-45201.cms","HC quashes demand for subject-wise reservation"
"1701353137-336","https://timesofindia.indiatimes.com/2023/10/2/archivelist/year-2023,month-10,starttime-45201.cms","Vivek Agnihotri reacts to the lukewarm response to The Vaccine War"
"1701353137-337","https://timesofindia.indiatimes.com/2023/10/2/archivelist/year-2023,month-10,starttime-45201.cms","State edu portal adds ‘transgender’ option"
"1701353137-338","https://timesofindia.indiatimes.com/2023/10/2/archivelist/year-2023,month-10,starttime-45201.cms","Sec V set to get facelift with underground ducts, welcome gate; fresh site for smart street project"
"1701353137-339","https://timesofindia.indiatimes.com/2023/10/2/archivelist/year-2023,month-10,starttime-45201.cms","Two nabbed for assault, robbery"
"1701353137-340","https://timesofindia.indiatimes.com/2023/10/2/archivelist/year-2023,month-10,starttime-45201.cms","Bagan ready for a ‘different’ Maziya"
"1701353137-341","https://timesofindia.indiatimes.com/2023/10/2/archivelist/year-2023,month-10,starttime-45201.cms","BJP doubles size of its Ngp rural unit"
"1701353137-342","https://timesofindia.indiatimes.com/2023/10/2/archivelist/year-2023,month-10,starttime-45201.cms","Truth may prevail in Derby"
"1701353137-343","https://timesofindia.indiatimes.com/2023/10/2/archivelist/year-2023,month-10,starttime-45201.cms","Sontu on run, PIL filed against online gambling apps"
"1701353137-344","https://timesofindia.indiatimes.com/2023/10/2/archivelist/year-2023,month-10,starttime-45201.cms","Collector and rural police join hands to take on sand mafia"
"1701353137-345","https://timesofindia.indiatimes.com/2023/10/2/archivelist/year-2023,month-10,starttime-45201.cms","Robbery solved within a week, two arrested"
"1701353137-346","https://timesofindia.indiatimes.com/2023/10/2/archivelist/year-2023,month-10,starttime-45201.cms","Aviary at Pench to boost conservation of vultures"
"1701353137-347","https://timesofindia.indiatimes.com/2023/10/2/archivelist/year-2023,month-10,starttime-45201.cms","Man booked for rape in Ratibad"
"1701353137-348","https://timesofindia.indiatimes.com/2023/10/2/archivelist/year-2023,month-10,starttime-45201.cms","Wildlife week celebrationskick off with cycle rally"
"1701353137-349","https://timesofindia.indiatimes.com/2023/10/2/archivelist/year-2023,month-10,starttime-45201.cms","Those engaged in love jihad, conversions are demons: VHP leader"
"1701353137-350","https://timesofindia.indiatimes.com/2023/10/2/archivelist/year-2023,month-10,starttime-45201.cms","3 suspected suicide in Bhopal on Sat"
"1701353137-351","https://timesofindia.indiatimes.com/2023/10/2/archivelist/year-2023,month-10,starttime-45201.cms","How ODI cricket's paradigm shift diminished the role of part-time bowlers"
"1701353137-352","https://timesofindia.indiatimes.com/2023/10/2/archivelist/year-2023,month-10,starttime-45201.cms","Principal, vice-principal booked for beating boy for absence from school"
"1701353137-353","https://timesofindia.indiatimes.com/2023/10/2/archivelist/year-2023,month-10,starttime-45201.cms","Youths are jobless & frustrated, vote with caution: Kamal Nath"
"1701353137-354","https://timesofindia.indiatimes.com/2023/10/2/archivelist/year-2023,month-10,starttime-45201.cms","Governor, CM join BMC’s hour-long cleanliness drive"
"1701353137-355","https://timesofindia.indiatimes.com/2023/10/2/archivelist/year-2023,month-10,starttime-45201.cms","BJP using ‘ICE formula’ to silence opponents: Sule"
"1701353137-356","https://timesofindia.indiatimes.com/2023/10/2/archivelist/year-2023,month-10,starttime-45201.cms","BSP joins hands with GGP, agrees on 178-52 seat sharing"
"1701353137-357","https://timesofindia.indiatimes.com/2023/10/2/archivelist/year-2023,month-10,starttime-45201.cms","Day temp crosses 33 but nights get colder in Bhopal"
"1701353137-358","https://timesofindia.indiatimes.com/2023/10/2/archivelist/year-2023,month-10,starttime-45201.cms","Chikungunya cases surge in Sept, 94 reported in Bhopal"
"1701353137-359","https://timesofindia.indiatimes.com/2023/10/2/archivelist/year-2023,month-10,starttime-45201.cms","Explainer: Why Afghan embassy suspended its operations in India"
"1701353137-360","https://timesofindia.indiatimes.com/2023/10/2/archivelist/year-2023,month-10,starttime-45201.cms","IAF chopper makes emergency landing near Bhopal"
"1701353137-361","https://timesofindia.indiatimes.com/2023/10/2/archivelist/year-2023,month-10,starttime-45201.cms","PM Modi to visit Gwalior today"
"1701353137-362","https://timesofindia.indiatimes.com/2023/10/2/archivelist/year-2023,month-10,starttime-45201.cms","Jageshwari Mata Mandir Lok to come up at Chanderi: CM"
"1701353137-363","https://timesofindia.indiatimes.com/2023/10/2/archivelist/year-2023,month-10,starttime-45201.cms","Being stalked: Bangre; All’s well, say Betul cops"
"1701353137-364","https://timesofindia.indiatimes.com/2023/10/2/archivelist/year-2023,month-10,starttime-45201.cms","Govt’s decision to suspend recoveries bleed discoms"
"1701353137-365","https://timesofindia.indiatimes.com/2023/10/2/archivelist/year-2023,month-10,starttime-45201.cms","Have informed leaders about tickets: Nath"
"1701353137-366","https://timesofindia.indiatimes.com/2023/10/2/archivelist/year-2023,month-10,starttime-45201.cms","Revenue dept to evict CPM offices, bank"
"1701353137-367","https://timesofindia.indiatimes.com/2023/10/2/archivelist/year-2023,month-10,starttime-45201.cms","KCZMA nod to coastal plan first step in its finalization"
"1701353137-368","https://timesofindia.indiatimes.com/2023/10/2/archivelist/year-2023,month-10,starttime-45201.cms","Each vote counts: At 112 years of age, Ramkunvar & Masum raring to cast their votes in MP polls"
"1701353137-369","https://timesofindia.indiatimes.com/2023/10/2/archivelist/year-2023,month-10,starttime-45201.cms","Woman gangraped by four in Madhya Pradesh's Ashoknagar district"
"1701353137-370","https://timesofindia.indiatimes.com/2023/10/2/archivelist/year-2023,month-10,starttime-45201.cms","DLSA secretary inspects Gandhi Bhavan"
"1701353137-371","https://timesofindia.indiatimes.com/2023/10/2/archivelist/year-2023,month-10,starttime-45201.cms","ECI fetes voters above 80"
"1701353137-372","https://timesofindia.indiatimes.com/2023/10/2/archivelist/year-2023,month-10,starttime-45201.cms","A for Ahimsa: Ashram to collaborate with schools to teach non-violence"
"1701353137-373","https://timesofindia.indiatimes.com/2023/10/2/archivelist/year-2023,month-10,starttime-45201.cms","VACB unearths irregularities in 70 Bevco outlets"
"1701353137-374","https://timesofindia.indiatimes.com/2023/10/2/archivelist/year-2023,month-10,starttime-45201.cms","Vibrant Gujarat-Vibrant District programme begins"
"1701353137-375","https://timesofindia.indiatimes.com/2023/10/2/archivelist/year-2023,month-10,starttime-45201.cms","Malnourishment has ‘stunted’ 51% kids in MP: Rajput"
"1701353137-376","https://timesofindia.indiatimes.com/2023/10/2/archivelist/year-2023,month-10,starttime-45201.cms","Fishers released from Iran jail recount ordeal to min"
"1701353137-377","https://timesofindia.indiatimes.com/2023/10/2/archivelist/year-2023,month-10,starttime-45201.cms","Increase awareness about cleanliness: Shah"
"1701353137-378","https://timesofindia.indiatimes.com/2023/10/2/archivelist/year-2023,month-10,starttime-45201.cms","‘Mahatma pioneered sustainable fashion’"
"1701353137-379","https://timesofindia.indiatimes.com/2023/10/2/archivelist/year-2023,month-10,starttime-45201.cms","JD(S) state unit not to join NDA front, say leaders"
"1701353137-380","https://timesofindia.indiatimes.com/2023/10/2/archivelist/year-2023,month-10,starttime-45201.cms","Neighbours thrash couple in Ahmedabad over lift snag"
"1701353137-381","https://timesofindia.indiatimes.com/2023/10/2/archivelist/year-2023,month-10,starttime-45201.cms","Deadline to avail of tax benefit for unused property extended"
"1701353137-382","https://timesofindia.indiatimes.com/2023/10/2/archivelist/year-2023,month-10,starttime-45201.cms","EC seeks services of 25 IAS officers from state"
"1701353137-383","https://timesofindia.indiatimes.com/2023/10/2/archivelist/year-2023,month-10,starttime-45201.cms","PCMC sets itself 27 major deadlines in bid to resolve Pimpri Chinchwad’s infra woes"
"1701353137-384","https://timesofindia.indiatimes.com/2023/10/2/archivelist/year-2023,month-10,starttime-45201.cms","13-year-old girl alleges harassment"
"1701353137-385","https://timesofindia.indiatimes.com/2023/10/2/archivelist/year-2023,month-10,starttime-45201.cms","Tourists trickle in to Vanjangi hills much before winter onset"
"1701353137-386","https://timesofindia.indiatimes.com/2023/10/2/archivelist/year-2023,month-10,starttime-45201.cms","47-year-old man killed, body found in sack"
"1701353137-387","https://timesofindia.indiatimes.com/2023/10/2/archivelist/year-2023,month-10,starttime-45201.cms","16-year-old girl goes missing"
"1701353137-388","https://timesofindia.indiatimes.com/2023/10/2/archivelist/year-2023,month-10,starttime-45201.cms","Bhavya in junior billiards final"
"1701353137-389","https://timesofindia.indiatimes.com/2023/10/2/archivelist/year-2023,month-10,starttime-45201.cms","Big Brother 25: Cameron convinces the housemates to vote Cory and Matt out"
"1701353137-390","https://timesofindia.indiatimes.com/2023/10/2/archivelist/year-2023,month-10,starttime-45201.cms","Navy conducts cleanup drives at beaches in Vizag"
"1701353137-391","https://timesofindia.indiatimes.com/2023/10/2/archivelist/year-2023,month-10,starttime-45201.cms","Tamil Nadu clinch title"
"1701353137-392","https://timesofindia.indiatimes.com/2023/10/2/archivelist/year-2023,month-10,starttime-45201.cms","Death threats to rape complainant from accused cop, family"
"1701353137-393","https://timesofindia.indiatimes.com/2023/10/2/archivelist/year-2023,month-10,starttime-45201.cms","Couple killed as lorry hits scooter"
"1701353137-394","https://timesofindia.indiatimes.com/2023/10/2/archivelist/year-2023,month-10,starttime-45201.cms","Huge fire erupts at police premises in Egypt's Ismailia"
"1701353137-395","https://timesofindia.indiatimes.com/2023/10/2/archivelist/year-2023,month-10,starttime-45201.cms","Minor among 2 killed as heavy rain lashes state"
"1701353137-396","https://timesofindia.indiatimes.com/2023/10/2/archivelist/year-2023,month-10,starttime-45201.cms","7% of state’s agri workforce shifted to other vocations in 35 years: Report"
"1701353137-397","https://timesofindia.indiatimes.com/2023/10/2/archivelist/year-2023,month-10,starttime-45201.cms","State award for Vizag convention centre"
"1701353137-398","https://timesofindia.indiatimes.com/2023/10/2/archivelist/year-2023,month-10,starttime-45201.cms","Three bike lifting gangs arrested, 18 bikes seized"
"1701353137-399","https://timesofindia.indiatimes.com/2023/10/2/archivelist/year-2023,month-10,starttime-45201.cms","JNAC issues helpline numbers to fight dengue"
"1701353137-400","https://timesofindia.indiatimes.com/2023/10/2/archivelist/year-2023,month-10,starttime-45201.cms","Rain, wind cause blackout in Chatra"
"1701353137-401","https://timesofindia.indiatimes.com/2023/10/2/archivelist/year-2023,month-10,starttime-45201.cms","Two who flew from Chandigarh to A’bad to steal from ATM held"
"1701353137-402","https://timesofindia.indiatimes.com/2023/10/2/archivelist/year-2023,month-10,starttime-45201.cms","Committed to revamp, beautification of every part of Delhi, says LG VK Saxena"
"1701353137-403","https://timesofindia.indiatimes.com/2023/10/2/archivelist/year-2023,month-10,starttime-45201.cms","Patratu dam water level nears danger mark"
"1701353137-404","https://timesofindia.indiatimes.com/2023/10/2/archivelist/year-2023,month-10,starttime-45201.cms","RPF jawan’s phone stolen from barrack"
"1701353137-405","https://timesofindia.indiatimes.com/2023/10/2/archivelist/year-2023,month-10,starttime-45201.cms","Three rivers around Bokaro in full spate, city areas waterlogged"
"1701353137-406","https://timesofindia.indiatimes.com/2023/10/2/archivelist/year-2023,month-10,starttime-45201.cms","Schools remember Father of Nation"
"1701353137-407","https://timesofindia.indiatimes.com/2023/10/2/archivelist/year-2023,month-10,starttime-45201.cms","Admission to entry-level classes kicks off in JSR"
"1701353137-408","https://timesofindia.indiatimes.com/2023/10/2/archivelist/year-2023,month-10,starttime-45201.cms","Convention of Ajsu-P goes beyond borders"
"1701353137-409","https://timesofindia.indiatimes.com/2023/10/2/archivelist/year-2023,month-10,starttime-45201.cms","GVMC conducts beach cleanup prog"
"1701353137-410","https://timesofindia.indiatimes.com/2023/10/2/archivelist/year-2023,month-10,starttime-45201.cms","‘Dhanbad law and order not conducive for industrial growth’"
"1701353137-411","https://timesofindia.indiatimes.com/2023/10/2/archivelist/year-2023,month-10,starttime-45201.cms","Survey finds Andhra Pradesh 3rd in teen pregnancies"
"1701353137-412","https://timesofindia.indiatimes.com/2023/10/2/archivelist/year-2023,month-10,starttime-45201.cms","Survey finds Andhra Pradesh 3rd in teen pregnancies"
"1701353137-413","https://timesofindia.indiatimes.com/2023/10/2/archivelist/year-2023,month-10,starttime-45201.cms","U-17 Subroto title winner honoured"
"1701353137-414","https://timesofindia.indiatimes.com/2023/10/2/archivelist/year-2023,month-10,starttime-45201.cms","Tribal bodies to protest in Delhi on Oct 6 against Uniform Civil Code"
"1701353137-415","https://timesofindia.indiatimes.com/2023/10/2/archivelist/year-2023,month-10,starttime-45201.cms","DPS Anandapuram ranks 1st in AP"
"1701353137-416","https://timesofindia.indiatimes.com/2023/10/2/archivelist/year-2023,month-10,starttime-45201.cms","Feels like summer in Oct as temp soars to 34 Celsius"
"1701353137-417","https://timesofindia.indiatimes.com/2023/10/2/archivelist/year-2023,month-10,starttime-45201.cms","Priyanka’s public meet in Dhar on Oct 5"
"1701353137-418","https://timesofindia.indiatimes.com/2023/10/2/archivelist/year-2023,month-10,starttime-45201.cms","240 ‘disqualified’ candidates included in SSE-2019 interview"
"1701353137-419","https://timesofindia.indiatimes.com/2023/10/2/archivelist/year-2023,month-10,starttime-45201.cms","Golden girl returns to city, gets grand welcome"
"1701353137-420","https://timesofindia.indiatimes.com/2023/10/2/archivelist/year-2023,month-10,starttime-45201.cms","Walkathon kicks off wildlife celebration week in Ranchi"
"1701353137-421","https://timesofindia.indiatimes.com/2023/10/2/archivelist/year-2023,month-10,starttime-45201.cms","2 killed, 3 injured in car crash"
"1701353137-422","https://timesofindia.indiatimes.com/2023/10/2/archivelist/year-2023,month-10,starttime-45201.cms","Woman janpad panchayat chief in Madhya Pradesh ends life by hanging self"
"1701353137-423","https://timesofindia.indiatimes.com/2023/10/2/archivelist/year-2023,month-10,starttime-45201.cms","14-min cleaning process introduced on Vande Bharat"
"1701353137-424","https://timesofindia.indiatimes.com/2023/10/2/archivelist/year-2023,month-10,starttime-45201.cms","Seniors advised to give importance to their health"
"1701353137-425","https://timesofindia.indiatimes.com/2023/10/2/archivelist/year-2023,month-10,starttime-45201.cms","Two girls stranded mid-river rescued"
"1701353137-426","https://timesofindia.indiatimes.com/2023/10/2/archivelist/year-2023,month-10,starttime-45201.cms","Mysureans engage in ‘shramdaan’ to clean city"
"1701353137-427","https://timesofindia.indiatimes.com/2023/10/2/archivelist/year-2023,month-10,starttime-45201.cms","Cleanliness drive held at Meenakshipura near KRS"
"1701353137-428","https://timesofindia.indiatimes.com/2023/10/2/archivelist/year-2023,month-10,starttime-45201.cms","PM Modi makes deceptive promises during visits: CM"
"1701353137-429","https://timesofindia.indiatimes.com/2023/10/2/archivelist/year-2023,month-10,starttime-45201.cms","Over 2K civic body workers participate in cleanliness drive"
"1701353137-430","https://timesofindia.indiatimes.com/2023/10/2/archivelist/year-2023,month-10,starttime-45201.cms","State’s new tribal front: HRP sets sights on polls"
"1701353137-431","https://timesofindia.indiatimes.com/2023/10/2/archivelist/year-2023,month-10,starttime-45201.cms","Leopardess captured in Mysuru village"
"1701353137-432","https://timesofindia.indiatimes.com/2023/10/2/archivelist/year-2023,month-10,starttime-45201.cms","Contribute to nation’s devpt, BIT Mesra students urged"
"1701353137-433","https://timesofindia.indiatimes.com/2023/10/2/archivelist/year-2023,month-10,starttime-45201.cms","VMC clears 100 ‘dumps’ in 1-hr drive"
"1701353137-434","https://timesofindia.indiatimes.com/2023/10/2/archivelist/year-2023,month-10,starttime-45201.cms","Conspiracy to prevent people from attending PM’s rally: BJP"
"1701353137-435","https://timesofindia.indiatimes.com/2023/10/2/archivelist/year-2023,month-10,starttime-45201.cms","Proposal sought for de-addiction centre in Daltonganj"
"1701353137-436","https://timesofindia.indiatimes.com/2023/10/2/archivelist/year-2023,month-10,starttime-45201.cms","Cop critical after being attacked by drunk man"
"1701353137-437","https://timesofindia.indiatimes.com/2023/10/2/archivelist/year-2023,month-10,starttime-45201.cms","Withdrawal of southwest monsoon begins in Uttarakhand, says IMD"
"1701353137-438","https://timesofindia.indiatimes.com/2023/10/2/archivelist/year-2023,month-10,starttime-45201.cms","Trial yet to begin even after 4 yrs, HC gives bail to accused"
"1701353137-439","https://timesofindia.indiatimes.com/2023/10/2/archivelist/year-2023,month-10,starttime-45201.cms","Andhra Pradesh: TDP calls for 1-day hunger strike today over N Chandrababu Naidu's arrest"
"1701353137-440","https://timesofindia.indiatimes.com/2023/10/2/archivelist/year-2023,month-10,starttime-45201.cms","Ticket seekers protest at Silawat’s event in Sanwer"
"1701353137-441","https://timesofindia.indiatimes.com/2023/10/2/archivelist/year-2023,month-10,starttime-45201.cms","Illicit liquor worth ₹41 lakh seized from truck, 4 held"
"1701353137-442","https://timesofindia.indiatimes.com/2023/10/2/archivelist/year-2023,month-10,starttime-45201.cms","Durga temple EO transferred"
