web-scraper-order,web-scraper-start-url,News
"1701353242-286","https://timesofindia.indiatimes.com/2023/10/4/archivelist/year-2023,month-10,starttime-45203.cms","State’s new cell for medical purchases hasn’t taken off"
"1701353242-287","https://timesofindia.indiatimes.com/2023/10/4/archivelist/year-2023,month-10,starttime-45203.cms","2008 Malegaon blast trial: Sadhvi Pragya gets emotional in court"
"1701353242-288","https://timesofindia.indiatimes.com/2023/10/4/archivelist/year-2023,month-10,starttime-45203.cms","Health, med edu mins must quit, book state govt: Oppn"
"1701353242-289","https://timesofindia.indiatimes.com/2023/10/4/archivelist/year-2023,month-10,starttime-45203.cms","Pothole death: HC raps Thane collector for shoddy probe, seeks fresh inquiry"
"1701353242-290","https://timesofindia.indiatimes.com/2023/10/4/archivelist/year-2023,month-10,starttime-45203.cms","Put off polls in ‘good faith’ on state’s directions: MU to HC"
"1701353242-291","https://timesofindia.indiatimes.com/2023/10/4/archivelist/year-2023,month-10,starttime-45203.cms","2,359 GPs to go to polls on Nov 5"
"1701353242-292","https://timesofindia.indiatimes.com/2023/10/4/archivelist/year-2023,month-10,starttime-45203.cms","Flights cancelled as typhoon Koinu grinds towards Taiwan"
"1701353242-293","https://timesofindia.indiatimes.com/2023/10/4/archivelist/year-2023,month-10,starttime-45203.cms","DGP Seth is frontrunner for the post of MPSC chief"
"1701353242-294","https://timesofindia.indiatimes.com/2023/10/4/archivelist/year-2023,month-10,starttime-45203.cms","In Mumbai, 73-year-old man duped of over 1 lakh by sextortionists"
"1701353242-295","https://timesofindia.indiatimes.com/2023/10/4/archivelist/year-2023,month-10,starttime-45203.cms","Bollards: BMC gets HC notice on wheelchair user’s petition"
"1701353242-296","https://timesofindia.indiatimes.com/2023/10/4/archivelist/year-2023,month-10,starttime-45203.cms","Govt to offer Rs 100 groceries in ration this Diwali too"
"1701353242-297","https://timesofindia.indiatimes.com/2023/10/4/archivelist/year-2023,month-10,starttime-45203.cms","Uganda Airlines to start non-stop Mumbai flights"
"1701353242-298","https://timesofindia.indiatimes.com/2023/10/4/archivelist/year-2023,month-10,starttime-45203.cms","Scholarship for minorities to study abroad"
"1701353242-299","https://timesofindia.indiatimes.com/2023/10/4/archivelist/year-2023,month-10,starttime-45203.cms","CM Eknath Shinde & Devendra Fadnavis head to Delhi; Ajit Pawar ‘unwell’ but meets NCP ministers"
"1701353242-300","https://timesofindia.indiatimes.com/2023/10/4/archivelist/year-2023,month-10,starttime-45203.cms","2-3 men trapped in Satna house collapse"
"1701353242-301","https://timesofindia.indiatimes.com/2023/10/4/archivelist/year-2023,month-10,starttime-45203.cms","2 held from Uran with over 6kg charas worth Rs 23 lakh"
"1701353242-302","https://timesofindia.indiatimes.com/2023/10/4/archivelist/year-2023,month-10,starttime-45203.cms","Fadnavis calls on BJP workers to ‘sacrifice’ for 2024"
"1701353242-303","https://timesofindia.indiatimes.com/2023/10/4/archivelist/year-2023,month-10,starttime-45203.cms","Thackeray Sena keen to contest 8 out of 10 Lok Sabha seats in MMR"
"1701353242-304","https://timesofindia.indiatimes.com/2023/10/4/archivelist/year-2023,month-10,starttime-45203.cms","UBT’s ‘2-3 day ultimatum’ to BMC for Dussehra rally nod"
"1701353242-305","https://timesofindia.indiatimes.com/2023/10/4/archivelist/year-2023,month-10,starttime-45203.cms","Botulism spread kills 10, infects 75 cattles in Raigad"
"1701353242-306","https://timesofindia.indiatimes.com/2023/10/4/archivelist/year-2023,month-10,starttime-45203.cms","Indian cos with overseas staff on deputation get GST notices"
"1701353242-307","https://timesofindia.indiatimes.com/2023/10/4/archivelist/year-2023,month-10,starttime-45203.cms","235 mobiles recovered from gang of thieves"
"1701353242-308","https://timesofindia.indiatimes.com/2023/10/4/archivelist/year-2023,month-10,starttime-45203.cms","4 trekkers lose way to Ratnagiri fort, rescued"
"1701353242-309","https://timesofindia.indiatimes.com/2023/10/4/archivelist/year-2023,month-10,starttime-45203.cms","Cashier embezzles 50L from Panvel co, arrested from locked apartment"
"1701353242-310","https://timesofindia.indiatimes.com/2023/10/4/archivelist/year-2023,month-10,starttime-45203.cms","High rating upgrades signal strong H1 show by India Inc"
"1701353242-311","https://timesofindia.indiatimes.com/2023/10/4/archivelist/year-2023,month-10,starttime-45203.cms","6 in 10 filing ITR in Karnataka have ‘zero tax liability’"
"1701353242-312","https://timesofindia.indiatimes.com/2023/10/4/archivelist/year-2023,month-10,starttime-45203.cms","Miscreants lure duo with jobs, steal 82L"
"1701353242-313","https://timesofindia.indiatimes.com/2023/10/4/archivelist/year-2023,month-10,starttime-45203.cms","Retired Cidco engineer booked after wife alleges rape, harassment"
"1701353242-314","https://timesofindia.indiatimes.com/2023/10/4/archivelist/year-2023,month-10,starttime-45203.cms","Doc agrees to community service, gets HC relief"
"1701353242-315","https://timesofindia.indiatimes.com/2023/10/4/archivelist/year-2023,month-10,starttime-45203.cms","N Jayaram takes over as BDA chief"
"1701353242-316","https://timesofindia.indiatimes.com/2023/10/4/archivelist/year-2023,month-10,starttime-45203.cms","Separate BBMP health dist plan gains ground amid dengue crisis"
"1701353242-317","https://timesofindia.indiatimes.com/2023/10/4/archivelist/year-2023,month-10,starttime-45203.cms","Lack of iron can hurt kids’ IQ & memory: Doctors"
"1701353242-318","https://timesofindia.indiatimes.com/2023/10/4/archivelist/year-2023,month-10,starttime-45203.cms","Indian IT gears up for muted 2nd qtr results"
"1701353242-319","https://timesofindia.indiatimes.com/2023/10/4/archivelist/year-2023,month-10,starttime-45203.cms","U'khand HC seeks govt reply in 2018 corruption case"
"1701353242-320","https://timesofindia.indiatimes.com/2023/10/4/archivelist/year-2023,month-10,starttime-45203.cms","Thane: No full-time dean at Kalwa hospital where 18 died in August"
"1701353242-321","https://timesofindia.indiatimes.com/2023/10/4/archivelist/year-2023,month-10,starttime-45203.cms","Indian leaders are back on the saddle at Cognizant"
"1701353242-322","https://timesofindia.indiatimes.com/2023/10/4/archivelist/year-2023,month-10,starttime-45203.cms","Yogesh annexes 6-red snooker title"
"1701353242-323","https://timesofindia.indiatimes.com/2023/10/4/archivelist/year-2023,month-10,starttime-45203.cms","Drop launch plans, begin ops on entire Bengaluru Purple Line: Riders"
"1701353242-324","https://timesofindia.indiatimes.com/2023/10/4/archivelist/year-2023,month-10,starttime-45203.cms","Audio bulletin on buses: HC seeks ‘positive’ govt reply"
"1701353242-325","https://timesofindia.indiatimes.com/2023/10/4/archivelist/year-2023,month-10,starttime-45203.cms","Service roads sharing ORR burden turn accident-prone"
"1701353242-326","https://timesofindia.indiatimes.com/2023/10/4/archivelist/year-2023,month-10,starttime-45203.cms","Video gives a glimpse of Gaganyaan astronauts"
"1701353242-327","https://timesofindia.indiatimes.com/2023/10/4/archivelist/year-2023,month-10,starttime-45203.cms","Solving crime to robot wars, TechnoVIT 2023 has it all"
"1701353242-328","https://timesofindia.indiatimes.com/2023/10/4/archivelist/year-2023,month-10,starttime-45203.cms","Bengaluru FC hope for a turnaround at the Fortress"
"1701353242-329","https://timesofindia.indiatimes.com/2023/10/4/archivelist/year-2023,month-10,starttime-45203.cms","Traffic cops fill potholes; netizens question BBMP"
"1701353242-330","https://timesofindia.indiatimes.com/2023/10/4/archivelist/year-2023,month-10,starttime-45203.cms","PG medical admission: 150 seats vacant in various courses"
"1701353242-331","https://timesofindia.indiatimes.com/2023/10/4/archivelist/year-2023,month-10,starttime-45203.cms","PG medical admission: 150 seats vacant in various courses"
"1701353242-332","https://timesofindia.indiatimes.com/2023/10/4/archivelist/year-2023,month-10,starttime-45203.cms","PG medical admission: 150 seats vacant in various courses"
"1701353242-333","https://timesofindia.indiatimes.com/2023/10/4/archivelist/year-2023,month-10,starttime-45203.cms","PG medical admission: 150 seats vacant in various courses"
"1701353242-334","https://timesofindia.indiatimes.com/2023/10/4/archivelist/year-2023,month-10,starttime-45203.cms","PG medical admission: 150 seats vacant in various courses"
"1701353242-335","https://timesofindia.indiatimes.com/2023/10/4/archivelist/year-2023,month-10,starttime-45203.cms","PG medical admission: 150 seats vacant in various courses"
"1701353242-336","https://timesofindia.indiatimes.com/2023/10/4/archivelist/year-2023,month-10,starttime-45203.cms","VR, 3D images help docs remove tumours from baby"
"1701353242-337","https://timesofindia.indiatimes.com/2023/10/4/archivelist/year-2023,month-10,starttime-45203.cms","Five-star Karisma powers Kickstart"
"1701353242-338","https://timesofindia.indiatimes.com/2023/10/4/archivelist/year-2023,month-10,starttime-45203.cms","Life convict kills self in jail"
"1701353242-339","https://timesofindia.indiatimes.com/2023/10/4/archivelist/year-2023,month-10,starttime-45203.cms","Thief trips on sleeping man, gets caught"
"1701353242-340","https://timesofindia.indiatimes.com/2023/10/4/archivelist/year-2023,month-10,starttime-45203.cms","Long weekend woes: Traffic jam at Perungalathur"
"1701353242-341","https://timesofindia.indiatimes.com/2023/10/4/archivelist/year-2023,month-10,starttime-45203.cms","Hukamori best bet for Delhi feature event"
"1701353242-342","https://timesofindia.indiatimes.com/2023/10/4/archivelist/year-2023,month-10,starttime-45203.cms","10-yr-old, out fishing, drowns"
"1701353242-343","https://timesofindia.indiatimes.com/2023/10/4/archivelist/year-2023,month-10,starttime-45203.cms","Washi named Tamil Nadu T20 captain"
"1701353242-344","https://timesofindia.indiatimes.com/2023/10/4/archivelist/year-2023,month-10,starttime-45203.cms","Delhi-NCR earthquake: Worried about building collapse? It's not about height"
"1701353242-345","https://timesofindia.indiatimes.com/2023/10/4/archivelist/year-2023,month-10,starttime-45203.cms","Don’t fear failure, moon mission man tells students"
"1701353242-346","https://timesofindia.indiatimes.com/2023/10/4/archivelist/year-2023,month-10,starttime-45203.cms","Goods train speeds on way to yard, derails"
"1701353242-347","https://timesofindia.indiatimes.com/2023/10/4/archivelist/year-2023,month-10,starttime-45203.cms","HC slams Anna univ for unfilled teacher vacancies"
"1701353242-348","https://timesofindia.indiatimes.com/2023/10/4/archivelist/year-2023,month-10,starttime-45203.cms","Primary teachers boycott training"
"1701353242-349","https://timesofindia.indiatimes.com/2023/10/4/archivelist/year-2023,month-10,starttime-45203.cms","Grievances of residents fall on deaf ears in Ennore area sabha"
"1701353242-350","https://timesofindia.indiatimes.com/2023/10/4/archivelist/year-2023,month-10,starttime-45203.cms","RSS general secretary sees conspiracy in criticism of Sanatana Dharma"
"1701353242-351","https://timesofindia.indiatimes.com/2023/10/4/archivelist/year-2023,month-10,starttime-45203.cms","Seized Malayan Giant Squirrels rehabilitated at Children’s Park"
"1701353242-352","https://timesofindia.indiatimes.com/2023/10/4/archivelist/year-2023,month-10,starttime-45203.cms","Role-play sessions in English at GCC schools"
"1701353242-353","https://timesofindia.indiatimes.com/2023/10/4/archivelist/year-2023,month-10,starttime-45203.cms","Dr Agarwal’s to invest 225 cr in Mumbai, Pune"
"1701353242-354","https://timesofindia.indiatimes.com/2023/10/4/archivelist/year-2023,month-10,starttime-45203.cms","Talks with AIADMK on; will get good news: BJP leader"
"1701353242-355","https://timesofindia.indiatimes.com/2023/10/4/archivelist/year-2023,month-10,starttime-45203.cms","Watch out for trouble before polls: CM"
"1701353242-356","https://timesofindia.indiatimes.com/2023/10/4/archivelist/year-2023,month-10,starttime-45203.cms","Lambadas to emulate turmeric farmers, file over 1k nominations"
"1701353242-357","https://timesofindia.indiatimes.com/2023/10/4/archivelist/year-2023,month-10,starttime-45203.cms","School students connect with nature via new curriculum"
"1701353242-358","https://timesofindia.indiatimes.com/2023/10/4/archivelist/year-2023,month-10,starttime-45203.cms","AIADMK eyes new allies after break with BJP"
"1701353242-359","https://timesofindia.indiatimes.com/2023/10/4/archivelist/year-2023,month-10,starttime-45203.cms","Patel got liberation, another son of Guj will do good: PM"
"1701353242-360","https://timesofindia.indiatimes.com/2023/10/4/archivelist/year-2023,month-10,starttime-45203.cms","Political parties urge Centre to undertake caste census"
"1701353242-361","https://timesofindia.indiatimes.com/2023/10/4/archivelist/year-2023,month-10,starttime-45203.cms","NMDC clocks best ever H1 performance since inception"
"1701353242-362","https://timesofindia.indiatimes.com/2023/10/4/archivelist/year-2023,month-10,starttime-45203.cms","20% relief to govt staff: Cong"
"1701353242-363","https://timesofindia.indiatimes.com/2023/10/4/archivelist/year-2023,month-10,starttime-45203.cms","BRS abusing power, ensure fair elections in Telangana: Congress & BJP to poll panel"
"1701353242-364","https://timesofindia.indiatimes.com/2023/10/4/archivelist/year-2023,month-10,starttime-45203.cms","Fans cheer as Shah Rukh Khan recites 'Main Kaun Hoon' monologue from 'Jawan' at an event - WATCH video"
"1701353242-365","https://timesofindia.indiatimes.com/2023/10/4/archivelist/year-2023,month-10,starttime-45203.cms","Why did BRS approach PM after GHMC election: Bandi"
"1701353242-366","https://timesofindia.indiatimes.com/2023/10/4/archivelist/year-2023,month-10,starttime-45203.cms","CM Ashok Gehlot apologises to high court for his 'corruption' in judiciary remarks"
"1701353242-367","https://timesofindia.indiatimes.com/2023/10/4/archivelist/year-2023,month-10,starttime-45203.cms","HC: Upgrade ST settlements into revenue villages"
"1701353242-368","https://timesofindia.indiatimes.com/2023/10/4/archivelist/year-2023,month-10,starttime-45203.cms","Thick bond between BJP & BRS: Cong"
"1701353242-369","https://timesofindia.indiatimes.com/2023/10/4/archivelist/year-2023,month-10,starttime-45203.cms","Healthcare staff threaten to go on strike over GO 142"
"1701353242-370","https://timesofindia.indiatimes.com/2023/10/4/archivelist/year-2023,month-10,starttime-45203.cms","Another official caught with ₹15k"
"1701353242-371","https://timesofindia.indiatimes.com/2023/10/4/archivelist/year-2023,month-10,starttime-45203.cms","Hyd airport bags topspot in climate goals"
"1701353242-372","https://timesofindia.indiatimes.com/2023/10/4/archivelist/year-2023,month-10,starttime-45203.cms","15-yr-old girl dies by suicide in Dundigal"
"1701353242-373","https://timesofindia.indiatimes.com/2023/10/4/archivelist/year-2023,month-10,starttime-45203.cms","Man from city dies in US, kin seek visit visa"
"1701353242-374","https://timesofindia.indiatimes.com/2023/10/4/archivelist/year-2023,month-10,starttime-45203.cms","Revenue official, broker held with ₹1.5L bribe"
"1701353242-375","https://timesofindia.indiatimes.com/2023/10/4/archivelist/year-2023,month-10,starttime-45203.cms","100-bed hosp to come up in Uppal for ₹37cr"
"1701353242-376","https://timesofindia.indiatimes.com/2023/10/4/archivelist/year-2023,month-10,starttime-45203.cms","TSRTC chairman completes tenure"
"1701353242-377","https://timesofindia.indiatimes.com/2023/10/4/archivelist/year-2023,month-10,starttime-45203.cms","Babar’s knock in vain as Aussies prevail"
"1701353242-378","https://timesofindia.indiatimes.com/2023/10/4/archivelist/year-2023,month-10,starttime-45203.cms","Abhishek to HC: Judge taking on investigating agency role"
"1701353242-379","https://timesofindia.indiatimes.com/2023/10/4/archivelist/year-2023,month-10,starttime-45203.cms","Suvendu calls for CBI probe into MGNREGS funds ‘fraud’"
"1701353242-380","https://timesofindia.indiatimes.com/2023/10/4/archivelist/year-2023,month-10,starttime-45203.cms","Kilburn acquires ME Energy for ₹99 crore"
"1701353242-381","https://timesofindia.indiatimes.com/2023/10/4/archivelist/year-2023,month-10,starttime-45203.cms","2,700 Agniveers pass out, to join artillery regiments"
"1701353242-382","https://timesofindia.indiatimes.com/2023/10/4/archivelist/year-2023,month-10,starttime-45203.cms","Breakfast scheme for T govt schools from Oct 6"
"1701353242-383","https://timesofindia.indiatimes.com/2023/10/4/archivelist/year-2023,month-10,starttime-45203.cms","Be ready with relief camps: Govt to 7 dists"
"1701353242-384","https://timesofindia.indiatimes.com/2023/10/4/archivelist/year-2023,month-10,starttime-45203.cms","Lakshmir Bhandar now has 2 crore beneficiaries"
"1701353242-385","https://timesofindia.indiatimes.com/2023/10/4/archivelist/year-2023,month-10,starttime-45203.cms","Prof bodies write to edu min again"
"1701353242-386","https://timesofindia.indiatimes.com/2023/10/4/archivelist/year-2023,month-10,starttime-45203.cms","Vignesh, Vijay and Waseem slam centuries"
"1701353242-387","https://timesofindia.indiatimes.com/2023/10/4/archivelist/year-2023,month-10,starttime-45203.cms","Nets, repellent in demand as Kol rushes to take guard"
"1701353242-388","https://timesofindia.indiatimes.com/2023/10/4/archivelist/year-2023,month-10,starttime-45203.cms","Book gold now at current rate, buy later"
"1701353242-389","https://timesofindia.indiatimes.com/2023/10/4/archivelist/year-2023,month-10,starttime-45203.cms","MCH doctors, staffers skip a heartbeat along with IVF mom"
"1701353242-390","https://timesofindia.indiatimes.com/2023/10/4/archivelist/year-2023,month-10,starttime-45203.cms","College union polls not possible right now: State"
"1701353242-391","https://timesofindia.indiatimes.com/2023/10/4/archivelist/year-2023,month-10,starttime-45203.cms","VIP Rd traffic curbs for bridge repairs"
"1701353242-392","https://timesofindia.indiatimes.com/2023/10/4/archivelist/year-2023,month-10,starttime-45203.cms","True Marshal obliges"
"1701353242-393","https://timesofindia.indiatimes.com/2023/10/4/archivelist/year-2023,month-10,starttime-45203.cms","Traffic cops start probing first taxi plaint lodged on KP helpline 100"
"1701353242-394","https://timesofindia.indiatimes.com/2023/10/4/archivelist/year-2023,month-10,starttime-45203.cms","63-year-old falls prey to virus in Thakurpukur"
"1701353242-395","https://timesofindia.indiatimes.com/2023/10/4/archivelist/year-2023,month-10,starttime-45203.cms","West Bengal: Battered Salt Lake roads pray for pre-puja repairs"
"1701353242-396","https://timesofindia.indiatimes.com/2023/10/4/archivelist/year-2023,month-10,starttime-45203.cms","Cops tweak traffic signal timings to ease congestion"
"1701353242-397","https://timesofindia.indiatimes.com/2023/10/4/archivelist/year-2023,month-10,starttime-45203.cms","Edu forum points finger at governor"
"1701353242-398","https://timesofindia.indiatimes.com/2023/10/4/archivelist/year-2023,month-10,starttime-45203.cms","Ruckus at Lenin Sarani hospital after death of 35-yr-old patient"
"1701353242-399","https://timesofindia.indiatimes.com/2023/10/4/archivelist/year-2023,month-10,starttime-45203.cms","Ahead of pujas, cops arrest 1,396 in 4 days"
"1701353242-400","https://timesofindia.indiatimes.com/2023/10/4/archivelist/year-2023,month-10,starttime-45203.cms","Disbursement of ₹10,000 deluge aid from tomorrow"
"1701353242-401","https://timesofindia.indiatimes.com/2023/10/4/archivelist/year-2023,month-10,starttime-45203.cms","First manja mishap on Maa since June 2022"
"1701353242-402","https://timesofindia.indiatimes.com/2023/10/4/archivelist/year-2023,month-10,starttime-45203.cms","Nanoparticles pose mega risk to Delhi"
"1701353242-403","https://timesofindia.indiatimes.com/2023/10/4/archivelist/year-2023,month-10,starttime-45203.cms","‘Shola-gram’ races against time to craft Durga ornaments"
"1701353242-404","https://timesofindia.indiatimes.com/2023/10/4/archivelist/year-2023,month-10,starttime-45203.cms","Not authorised but Mehadia settled land affair at very low price: Report"
"1701353242-405","https://timesofindia.indiatimes.com/2023/10/4/archivelist/year-2023,month-10,starttime-45203.cms","Jena hopes to claim a medal and book 2024 Paris Olympics berth"
"1701353242-406","https://timesofindia.indiatimes.com/2023/10/4/archivelist/year-2023,month-10,starttime-45203.cms","Delayed state payments: Schools ‘collecting’ fees from RTE students"
"1701353242-407","https://timesofindia.indiatimes.com/2023/10/4/archivelist/year-2023,month-10,starttime-45203.cms","Entrusted firm can’t dispose of nylon manja scientifically, HC told"
"1701353242-408","https://timesofindia.indiatimes.com/2023/10/4/archivelist/year-2023,month-10,starttime-45203.cms","EB look to conquer Bengaluru again"
"1701353242-409","https://timesofindia.indiatimes.com/2023/10/4/archivelist/year-2023,month-10,starttime-45203.cms","Remove wisdom tooth only if needed: Doctors"
"1701353242-410","https://timesofindia.indiatimes.com/2023/10/4/archivelist/year-2023,month-10,starttime-45203.cms","Park Circus mkt traders may get waiver for shifting"
"1701353242-411","https://timesofindia.indiatimes.com/2023/10/4/archivelist/year-2023,month-10,starttime-45203.cms","24 AC e-buses not delivered yet, NMC to fine company"
"1701353242-412","https://timesofindia.indiatimes.com/2023/10/4/archivelist/year-2023,month-10,starttime-45203.cms","Messi or No Messi, Chicago Fire promise an epic night to remember"
"1701353242-413","https://timesofindia.indiatimes.com/2023/10/4/archivelist/year-2023,month-10,starttime-45203.cms","Cong top brass hold meeting with state leaders to discuss ticket distribution"
"1701353242-414","https://timesofindia.indiatimes.com/2023/10/4/archivelist/year-2023,month-10,starttime-45203.cms","Paneer & millets to be added to midday meal in city schools"
"1701353242-415","https://timesofindia.indiatimes.com/2023/10/4/archivelist/year-2023,month-10,starttime-45203.cms","Cop, three others booked for abetment to suicide"
"1701353242-416","https://timesofindia.indiatimes.com/2023/10/4/archivelist/year-2023,month-10,starttime-45203.cms","At least four people shot on campus of Morgan State University in Baltimore, authorities say"
"1701353242-417","https://timesofindia.indiatimes.com/2023/10/4/archivelist/year-2023,month-10,starttime-45203.cms","Man held for molesting two women"
"1701353242-418","https://timesofindia.indiatimes.com/2023/10/4/archivelist/year-2023,month-10,starttime-45203.cms","CM gives 1,400 scooters to ‘paryavaran mitras’"
"1701353242-419","https://timesofindia.indiatimes.com/2023/10/4/archivelist/year-2023,month-10,starttime-45203.cms","Cops arrest man ‘kidnapped’ 4 mnths ago for ‘defrauding’ his abductors"
"1701353242-420","https://timesofindia.indiatimes.com/2023/10/4/archivelist/year-2023,month-10,starttime-45203.cms","Women reservation cannot be implemented sans OBC quota: Uma"
"1701353242-421","https://timesofindia.indiatimes.com/2023/10/4/archivelist/year-2023,month-10,starttime-45203.cms","‘INDIA to target 150 seats that oppn lost narrowly’"
"1701353242-422","https://timesofindia.indiatimes.com/2023/10/4/archivelist/year-2023,month-10,starttime-45203.cms","No need to demolish, Satpura Bhawan can be renovated: Report"
"1701353242-423","https://timesofindia.indiatimes.com/2023/10/4/archivelist/year-2023,month-10,starttime-45203.cms","Farmers can now expect agri pump connections faster"
"1701353242-424","https://timesofindia.indiatimes.com/2023/10/4/archivelist/year-2023,month-10,starttime-45203.cms","IED design paper seized from Delhi terror suspect Shahnawaz Alam's flat"
"1701353242-425","https://timesofindia.indiatimes.com/2023/10/4/archivelist/year-2023,month-10,starttime-45203.cms","Household goods worth ₹2L gutted"
"1701353242-426","https://timesofindia.indiatimes.com/2023/10/4/archivelist/year-2023,month-10,starttime-45203.cms","As monsoon ends, air pollution on rise again"
"1701353242-427","https://timesofindia.indiatimes.com/2023/10/4/archivelist/year-2023,month-10,starttime-45203.cms","Denied poll ticket, BJP Sidhi MLA likely to contest as independent"
"1701353242-428","https://timesofindia.indiatimes.com/2023/10/4/archivelist/year-2023,month-10,starttime-45203.cms","Sontu Jain’s elder brother made co-accused in fraud case"
"1701353242-429","https://timesofindia.indiatimes.com/2023/10/4/archivelist/year-2023,month-10,starttime-45203.cms","Hostellers injured in clash with day scholars"
"1701353242-430","https://timesofindia.indiatimes.com/2023/10/4/archivelist/year-2023,month-10,starttime-45203.cms","Woman axes daughter while she was asleep in Chhatarpur district"
"1701353242-431","https://timesofindia.indiatimes.com/2023/10/4/archivelist/year-2023,month-10,starttime-45203.cms","How is Vivek Ramaswamy’s former company doing without him?"
"1701353242-432","https://timesofindia.indiatimes.com/2023/10/4/archivelist/year-2023,month-10,starttime-45203.cms","Natl agency to record wetlands"
"1701353242-433","https://timesofindia.indiatimes.com/2023/10/4/archivelist/year-2023,month-10,starttime-45203.cms","Tvm Club raided, 9 held for gambling"
"1701353242-434","https://timesofindia.indiatimes.com/2023/10/4/archivelist/year-2023,month-10,starttime-45203.cms","CM lays foundation stone for state of art media centre"
"1701353242-435","https://timesofindia.indiatimes.com/2023/10/4/archivelist/year-2023,month-10,starttime-45203.cms","Cricket World Cup: To meet high demand, Gujarat Metro to run till 1am"
"1701353242-436","https://timesofindia.indiatimes.com/2023/10/4/archivelist/year-2023,month-10,starttime-45203.cms","Sub-standard supply of wheat under PDS in Jabalpur"
