web-scraper-order,web-scraper-start-url,News
"1701353242-437","https://timesofindia.indiatimes.com/2023/10/4/archivelist/year-2023,month-10,starttime-45203.cms","Central India’s 1st STEMI project to deal with heart-related issues"
"1701353242-438","https://timesofindia.indiatimes.com/2023/10/4/archivelist/year-2023,month-10,starttime-45203.cms","Bite alert: Dengue cases surge in Ahmedabad"
"1701353242-439","https://timesofindia.indiatimes.com/2023/10/4/archivelist/year-2023,month-10,starttime-45203.cms","8 yrs after woman, daughter killed in public, murderer gets death"
"1701353242-440","https://timesofindia.indiatimes.com/2023/10/4/archivelist/year-2023,month-10,starttime-45203.cms","HC lets anaemic teenage rape victim abort 26-week fetus"
"1701353242-441","https://timesofindia.indiatimes.com/2023/10/4/archivelist/year-2023,month-10,starttime-45203.cms","300-ft long tunnel at Mahakaleshwar temple complex"
"1701353242-442","https://timesofindia.indiatimes.com/2023/10/4/archivelist/year-2023,month-10,starttime-45203.cms","Focus on infotech, textile, social work in Global Nagpur Summit"
"1701353242-443","https://timesofindia.indiatimes.com/2023/10/4/archivelist/year-2023,month-10,starttime-45203.cms","Nip in air as monsoon set to withdraw from state"
"1701353242-444","https://timesofindia.indiatimes.com/2023/10/4/archivelist/year-2023,month-10,starttime-45203.cms","Stray cattle: CS asks for exemption from contempt hearings"
"1701353242-445","https://timesofindia.indiatimes.com/2023/10/4/archivelist/year-2023,month-10,starttime-45203.cms","PDS scam using rubber fingerprints unearthed"
"1701353242-446","https://timesofindia.indiatimes.com/2023/10/4/archivelist/year-2023,month-10,starttime-45203.cms","India vs Netherlands warm-up tie washed out"
"1701353242-447","https://timesofindia.indiatimes.com/2023/10/4/archivelist/year-2023,month-10,starttime-45203.cms","BJP’s Jan Ashirvad Yatra skips Waraseoni"
"1701353242-448","https://timesofindia.indiatimes.com/2023/10/4/archivelist/year-2023,month-10,starttime-45203.cms","3,000 bike crashes in city, 1 in 3 after hitting another bike"
"1701353242-449","https://timesofindia.indiatimes.com/2023/10/4/archivelist/year-2023,month-10,starttime-45203.cms","TV actress, ex-BJP MLA figure in AAP’s second list"
"1701353242-450","https://timesofindia.indiatimes.com/2023/10/4/archivelist/year-2023,month-10,starttime-45203.cms","Vaidehee begins title defence with easy win"
"1701353242-451","https://timesofindia.indiatimes.com/2023/10/4/archivelist/year-2023,month-10,starttime-45203.cms","Cricket World Cup: Traffic diversions for match days in Ahmedabad"
"1701353242-452","https://timesofindia.indiatimes.com/2023/10/4/archivelist/year-2023,month-10,starttime-45203.cms","Man booked on charges of attempt to commit culpable homicide"
"1701353242-453","https://timesofindia.indiatimes.com/2023/10/4/archivelist/year-2023,month-10,starttime-45203.cms","Vizag-based smart e-bike startup eyes foreign markets, to boost production"
"1701353242-454","https://timesofindia.indiatimes.com/2023/10/4/archivelist/year-2023,month-10,starttime-45203.cms","GCA creates six mini-ICUs for spectators at stadium"
"1701353242-455","https://timesofindia.indiatimes.com/2023/10/4/archivelist/year-2023,month-10,starttime-45203.cms","Court registers case for cheating and rape, summons accused"
"1701353242-456","https://timesofindia.indiatimes.com/2023/10/4/archivelist/year-2023,month-10,starttime-45203.cms","Man thrashes another over pet dog’s death"
"1701353242-457","https://timesofindia.indiatimes.com/2023/10/4/archivelist/year-2023,month-10,starttime-45203.cms","Man kills self over family disputes"
"1701353242-458","https://timesofindia.indiatimes.com/2023/10/4/archivelist/year-2023,month-10,starttime-45203.cms","Missing woman found murdered in Sambhal, rape suspected"
"1701353242-459","https://timesofindia.indiatimes.com/2023/10/4/archivelist/year-2023,month-10,starttime-45203.cms","Scam worth ₹26cr in aid for general category students"
"1701353242-460","https://timesofindia.indiatimes.com/2023/10/4/archivelist/year-2023,month-10,starttime-45203.cms","CM hands over 93 job letters, says offers to 1k teachers soon"
"1701353242-461","https://timesofindia.indiatimes.com/2023/10/4/archivelist/year-2023,month-10,starttime-45203.cms","Fire breaks out at govt health centre in Datia, no casualty"
"1701353242-462","https://timesofindia.indiatimes.com/2023/10/4/archivelist/year-2023,month-10,starttime-45203.cms","India’s worrisome tail"
"1701353242-463","https://timesofindia.indiatimes.com/2023/10/4/archivelist/year-2023,month-10,starttime-45203.cms","Dhurwa college prof transferred after harassment slur by colleague"
"1701353242-464","https://timesofindia.indiatimes.com/2023/10/4/archivelist/year-2023,month-10,starttime-45203.cms","Ahmedabad: Controversy erupts over video of namaaz in school"
"1701353242-465","https://timesofindia.indiatimes.com/2023/10/4/archivelist/year-2023,month-10,starttime-45203.cms","Faculty find academic load a major stressor"
"1701353242-466","https://timesofindia.indiatimes.com/2023/10/4/archivelist/year-2023,month-10,starttime-45203.cms","Encroachments on main routes removed"
"1701353242-467","https://timesofindia.indiatimes.com/2023/10/4/archivelist/year-2023,month-10,starttime-45203.cms","CPM & BJP two sides of same coin: Cong leaders"
"1701353242-468","https://timesofindia.indiatimes.com/2023/10/4/archivelist/year-2023,month-10,starttime-45203.cms","Rights forum condemns raids"
"1701353242-469","https://timesofindia.indiatimes.com/2023/10/4/archivelist/year-2023,month-10,starttime-45203.cms","Woman claims to be victim in cyberfraud investigation!"
"1701353242-470","https://timesofindia.indiatimes.com/2023/10/4/archivelist/year-2023,month-10,starttime-45203.cms","Man gets 20 yrs in jail for minor rape"
"1701353242-471","https://timesofindia.indiatimes.com/2023/10/4/archivelist/year-2023,month-10,starttime-45203.cms","Twin rivers close to danger mark in JSR"
"1701353242-472","https://timesofindia.indiatimes.com/2023/10/4/archivelist/year-2023,month-10,starttime-45203.cms","‘Expired chlorine tablets distributed’"
"1701353242-473","https://timesofindia.indiatimes.com/2023/10/4/archivelist/year-2023,month-10,starttime-45203.cms","Blacklisted agency picked for safety check of bridges"
"1701353242-474","https://timesofindia.indiatimes.com/2023/10/4/archivelist/year-2023,month-10,starttime-45203.cms","Mandsaur rape accused taken to crime spot"
"1701353242-475","https://timesofindia.indiatimes.com/2023/10/4/archivelist/year-2023,month-10,starttime-45203.cms","Rare congenital defect corrected at Civil"
"1701353242-476","https://timesofindia.indiatimes.com/2023/10/4/archivelist/year-2023,month-10,starttime-45203.cms","Para teachers protest outside JMM office"
"1701353242-477","https://timesofindia.indiatimes.com/2023/10/4/archivelist/year-2023,month-10,starttime-45203.cms","400 plaints pour in at public hearing"
"1701353242-478","https://timesofindia.indiatimes.com/2023/10/4/archivelist/year-2023,month-10,starttime-45203.cms","No opening ceremony for WC"
"1701353242-479","https://timesofindia.indiatimes.com/2023/10/4/archivelist/year-2023,month-10,starttime-45203.cms","Row over Soren’s photo at guv event"
"1701353242-480","https://timesofindia.indiatimes.com/2023/10/4/archivelist/year-2023,month-10,starttime-45203.cms","Mumbai: MSRTC to operate two non-AC sleeper coach buses on 2 routes"
"1701353242-481","https://timesofindia.indiatimes.com/2023/10/4/archivelist/year-2023,month-10,starttime-45203.cms","Four chain snatchers held"
"1701353242-482","https://timesofindia.indiatimes.com/2023/10/4/archivelist/year-2023,month-10,starttime-45203.cms","Woman murders 3-yr-old stepdaughter in ASR dist"
"1701353242-483","https://timesofindia.indiatimes.com/2023/10/4/archivelist/year-2023,month-10,starttime-45203.cms","HC seeks report from NIA, state on 2022 Ranchi strife"
"1701353242-484","https://timesofindia.indiatimes.com/2023/10/4/archivelist/year-2023,month-10,starttime-45203.cms","Woman among 2 booked for rape of minor girl"
"1701353242-485","https://timesofindia.indiatimes.com/2023/10/4/archivelist/year-2023,month-10,starttime-45203.cms","25-yr-old youth drowns in well"
"1701353242-486","https://timesofindia.indiatimes.com/2023/10/4/archivelist/year-2023,month-10,starttime-45203.cms","2 women held for robbing gold, cash"
"1701353242-487","https://timesofindia.indiatimes.com/2023/10/4/archivelist/year-2023,month-10,starttime-45203.cms","SSC JE Admit Card 2023 released at ssc.nic.in, download link here"
"1701353242-488","https://timesofindia.indiatimes.com/2023/10/4/archivelist/year-2023,month-10,starttime-45203.cms","Butterflies are in the air.. 50 species spotted in Kheoni"
"1701353242-489","https://timesofindia.indiatimes.com/2023/10/4/archivelist/year-2023,month-10,starttime-45203.cms","East S’bhum issues guidelines for Durga Puja samitis in Steel City"
"1701353242-490","https://timesofindia.indiatimes.com/2023/10/4/archivelist/year-2023,month-10,starttime-45203.cms","Gujarat: Woman dragged by joy train loses hand"
"1701353242-491","https://timesofindia.indiatimes.com/2023/10/4/archivelist/year-2023,month-10,starttime-45203.cms","CM to launch 50k litre milk plant in Palamu today"
"1701353242-492","https://timesofindia.indiatimes.com/2023/10/4/archivelist/year-2023,month-10,starttime-45203.cms","Puja held for 11 palace cannons"
"1701353242-493","https://timesofindia.indiatimes.com/2023/10/4/archivelist/year-2023,month-10,starttime-45203.cms","4 gang members of Wasseypur fugitive held"
"1701353242-494","https://timesofindia.indiatimes.com/2023/10/4/archivelist/year-2023,month-10,starttime-45203.cms","Rain in Kodagu pushes up inflow into KRS dam"
"1701353242-495","https://timesofindia.indiatimes.com/2023/10/4/archivelist/year-2023,month-10,starttime-45203.cms","MP has 5,253 voters aged above 100"
"1701353242-496","https://timesofindia.indiatimes.com/2023/10/4/archivelist/year-2023,month-10,starttime-45203.cms","Rain respite unlikely till Thursday: IMD"
"1701353242-497","https://timesofindia.indiatimes.com/2023/10/4/archivelist/year-2023,month-10,starttime-45203.cms","ISCDL seeks guidance for its future role after completion of projects"
"1701353242-498","https://timesofindia.indiatimes.com/2023/10/4/archivelist/year-2023,month-10,starttime-45203.cms","Tiger attack victim was warned not to enter forest"
"1701353242-499","https://timesofindia.indiatimes.com/2023/10/4/archivelist/year-2023,month-10,starttime-45203.cms","Schoolteacher held for sexual harassment of class 7 student"
"1701353242-500","https://timesofindia.indiatimes.com/2023/10/4/archivelist/year-2023,month-10,starttime-45203.cms","AAP releases 2nd list of 12 candidates ahead of elections"
